DocumentID,Source,Content,Number;;;;
gt_11,https://vbpl.vn/TW/Pages/vbpq-toanvan.aspx?ItemID=3700,CỦA HỘI ĐỒNG BỘ TRƯỞNG SỐ 13/HĐBT NGÀY 3 THÁNG 2 NĂM 1982 VỀ NHỮNG BIỆN PHÁP CẢI TIẾN VÀ PHÁT TRIỂN GIAO THÔNG,Nghị quyết 13/HĐBT;;;;
"gt_12,https://vbpl.vn/TW/Pages/vbpq-toanvan.aspx?ItemID=187505,""SỬA ĐỔI, BỔ SUNG MỘT SỐ ĐIỀU CỦA NGHỊ ĐỊNH SỐ 142/2017/NĐ-CP NGÀY 11 THÁNG 12 NĂM 2017 CỦA CHÍNH PHỦ QUY ĐỊNH XỬ PHẠT VI PHẠM HÀNH CHÍNH TRONG LĨNH VỰC HÀNG HẢI ĐƯỢC SỬA ĐỔI, BỔ SUNG THEO NGHỊ ĐỊNH SỐ 123/2021/NĐ-CP NGÀY 28 THÁNG 12 NĂM 2021 CỦA CHÍNH PHỦ VÀ NGHỊ ĐỊNH"",Nghị định 80/2026/NĐ-CP";;;;
"gt_13,https://vbpl.vn/TW/Pages/vbpq-toanvan.aspx?ItemID=186426,""SỬA ĐỔI, BỔ SUNG MỘT SỐ ĐIỀU CỦA NGHỊ ĐỊNH SỐ 162/2018/NĐ-CP NGÀY 30 THÁNG 11 NĂM 2018 CỦA CHÍNH PHỦ QUY ĐỊNH VỀ XỬ PHẠT VI PHẠM HÀNH CHÍNH TRONG LĨNH VỰC HÀNG KHÔNG DÂN DỤNG ĐƯỢC SỬA ĐỔI, BỔ SUNG BỞI NGHỊ ĐỊNH SỐ 123/2021/NĐ-CP NGÀY 28 THÁNG 12 NĂM 2021 CỦA CHÍNH PHỦ SỬA ĐỔI, BỔ SUNG MỘT SỐ ĐIỀU CỦA CÁC NGHỊ ĐỊNH QUY ĐỊNH XỬ PHẠT VI PHẠM HÀNH CHÍNH TRONG LĨNH VỰC HÀNG HẢI"; GIAO THÔNG ĐƯỜNG BỘ, ĐƯỜNG SẮT; HÀNG KHÔNG DÂN DỤNG VÀ NGHỊ ĐỊNH SỐ 282/2025/NĐ-CP NGÀY 30 THÁNG 10 NĂM 2025 CỦA CHÍNH PHỦ QUY ĐỊNH XỬ PHẠT VI PHẠM HÀNH CHÍNH TRONG LĨNH VỰC AN NINH, TRẬT TỰ, AN TOÀN XÃ HỘI; PHÒNG, CHỐNG TỆ NẠN XÃ HỘI;" PHÒNG, CHỐNG BẠO LỰC GIA ĐÌNH VỀ THẨM QUYỀN XỬ PHẠT VI PHẠM HÀNH CHÍNH"",Nghị định 17/2026/NĐ-CP"
"gt_14,https://vbpl.vn/TW/Pages/vbpq-toanvan.aspx?ItemID=186855,""QUY ĐỊNH VỀ THÀNH LẬP, NGUỒN TÀI CHÍNH HÌNH THÀNH, QUẢN LÝ, HOẠT ĐỘNG CHI, 1/01/CLIP_IMAGE001.GIF"""" WIDTH=""""142"""" />SỬ DỤNG QUỸ GIẢM THIỂU THIỆT HẠI TAI NẠN GIAO THÔNG ĐƯỜNG BỘ"",Nghị định 279/2025/NĐ-CP";;;;
"gt_15,https://vbpl.vn/TW/Pages/vbpq-toanvan.aspx?ItemID=174970,""QUY ĐỊNH QUẢN LÝ, SỬ DỤNG KINH PHÍ THU TỪ XỬ PHẠT VI PHẠM HÀNH CHÍNH VỀ TRẬT TỰ, AN TOÀN GIAO THÔNG ĐƯỜNG BỘ VÀ ĐẤU GIÁ"",Nghị định 176/2024/NĐ-CP";;;;
"gt_16,https://vbpl.vn/TW/Pages/vbpq-toanvan.aspx?ItemID=173920,""QUY ĐỊNH XỬ PHẠT VI PHẠM HÀNH CHÍNH VỀ TRẬT TỰ, AN TOÀN GIAO THÔNG TRONG LĨNH VỰC GIAO THÔNG ĐƯỜNG BỘ";" TRỪ ĐIỂM,"",Nghị định 168/2024/NĐ-CP";;;
"gt_17,https://vbpl.vn/TW/Pages/vbpq-toanvan.aspx?ItemID=173895,""QUY ĐỊNH CHI TIẾT, HƯỚNG DẪN THI HÀNH MỘT SỐ ĐIỀU CỦA LUẬT ĐƯỜNG BỘ VÀ ĐIỀU 77 LUẬT TRẬT TỰ, AN TOÀN GIAO THÔNG ĐƯỜNG BỘ"",Nghị định 165/2024/NĐ-CP";;;;
"gt_18,https://vbpl.vn/TW/Pages/vbpq-toanvan.aspx?ItemID=174961,""QUY ĐỊNH CHI TIẾT MỘT SỐ ĐIỀU VÀ BIỆN PHÁP THI HÀNH LUẬT TRẬT TỰ, AN TOÀN GIAO THÔNG ĐƯỜNG BỘ"",Nghị định 151/2024/NĐ-CP";;;;
"gt_19,https://vbpl.vn/TW/Pages/vbpq-toanvan.aspx?ItemID=177109,""QUY ĐỊNH CÔNG TÁC KIỂM TRA, KIỂM SOÁT VÀ XỬ LÝ VI PHẠM PHÁP LUẬT TRONG LĨNH VỰC GIAO THÔNG ĐƯỜNG SẮT CỦA CẢNH SÁT GIAO THÔNG"",Nghị định 63/2024/NĐ-CP";;;;
gt_20,https://vbpl.vn/TW/Pages/vbpq-toanvan.aspx?ItemID=12333,GIAO THÔNG ĐƯỜNG BỘ,Luật 23/2008/QH12;;;;
gt_21,https://vbpl.vn/TW/Pages/vbpq-toanvan.aspx?ItemID=172771,QUY ĐỊNH VỀ THANH TOÁN ĐIỆN TỬ GIAO THÔNG ĐƯỜNG BỘ,Nghị định 119/2024/NĐ-CP;;;;
"gt_22,https://vbpl.vn/TW/Pages/vbpq-toanvan.aspx?ItemID=166653,""QUY ĐỊNH DANH MỤC HÀNG HÓA NGUY HIỂM, VẬN CHUYỂN HÀNG HÓA NGUY HIỂM BẰNG PHƯƠNG TIỆN GIAO THÔNG CƠ GIỚI ĐƯỜNG BỘ"",Nghị định 34/2024/NĐ-CP";;;;
"gt_23,https://vbpl.vn/TW/Pages/vbpq-toanvan.aspx?ItemID=167281,""QUY ĐỊNH VỀ QUẢN LÝ PHƯƠNG TIỆN GIAO THÔNG CƠ GIỚI ĐƯỜNG BỘ ĐĂNG KÝ TẠI NƯỚC NGOÀI, DO NGƯỜI NƯỚC NGOÀI ĐƯA VÀO VIỆT NAM DU LỊCH"",Nghị định 30/2024/NĐ-CP";;;;
"gt_24,https://vbpl.vn/TW/Pages/vbpq-toanvan.aspx?ItemID=166650,""SỬA ĐỔI, BỔ SUNG MỘT SỐ ĐIỀU CỦA NGHỊ ĐỊNH SỐ 11/2010/NĐ-CPNGÀY 24 THÁNG 02 NĂM 2010 CỦA CHÍNH PHỦ QUY ĐỊNH VỀ QUẢN LÝ VÀ BẢO VỆKẾT CẤU HẠ TẦNG GIAO THÔNG ĐƯỜNG BỘ (ĐÃ ĐƯỢC SỬA ĐỔI, BỔ SUNG MỘT SỐĐIỀU TẠI NGHỊ ĐỊNH SỐ 100/2013/NĐ-CP NGÀY 03 THÁNG 9 NĂM 2013, NGHỊ ĐỊNH SỐ 64/2016/NĐ-CP NGÀY 01 THÁNG 7 NĂM 2016, NGHỊ ĐỊNH SỐ 125/2018/NĐ-CP NGÀY 19 THÁNG 9 NĂM 2018, NGHỊ ĐỊNH SỐ 117/2021/NĐ-CP NGÀY 22 THÁNG 12 NĂM 2021, NGHỊ ĐỊNH SỐ 70/2022/NĐ-CP NGÀY 27 THÁNG 9 NĂM 2022)"",Nghị định 01/2024/NĐ-CP";;;;
gt_25,https://vbpl.vn/TW/Pages/vbpq-toanvan.aspx?ItemID=166414,QUY ĐỊNH VỀ THÍ ĐIỂM TRƯỜNG HỢP ĐỒNG ĐỐI VỚI GÓI THẦU XÂY LẮP THUỘC CÁC DỰ ÁN GIAO THÔNG TRONG CHƯƠNG TRÌNH PHỤC HỒI VÀ PHÁT TRIỂN KINH TẾ - XÃ HỘI,Nghị định 15/2023/NĐ-CP;;;;
"gt_26,https://vbpl.vn/TW/Pages/vbpq-toanvan.aspx?ItemID=156175,""QUY ĐỊNH CHỨC NĂNG, NHIỆM VỤ, QUYỀN HẠN VÀ CƠ CẤU TỔ CHỨC CỦA BỘ GIAO THÔNG VẬN TẢI"",Nghị định 56/2022/NĐ-CP";;;;
gt_27,https://vbpl.vn/TW/Pages/vbpq-toanvan.aspx?ItemID=153266,QUY ĐỊNH XỬ PHẠT VI PHẠM HÀNH CHÍNH TRONG LĨNH VỰC GIAO THÔNG ĐƯỜNG THỦY NỘI ĐỊA,Nghị định 139/2021/NĐ-CP;;;;
"gt_28,https://vbpl.vn/TW/Pages/vbpq-toanvan.aspx?ItemID=153339,""SỬA ĐỔI, BỔ SUNG MỘT SỐ ĐIỀU CỦA CÁC NGHỊ ĐỊNH QUY ĐỊNH XỬ PHẠT VI PHẠM HÀNH CHÍNH TRONG LĨNH VỰC HÀNG HẢI"; GIAO THÔNG ĐƯỜNG BỘ, ĐƯỜNG SẮT;" HÀNG KHÔNG DÂN DỤNG"",Nghị định 123/2021/NĐ-CP";;
"gt_29,https://vbpl.vn/TW/Pages/vbpq-toanvan.aspx?ItemID=152456,""SỬA ĐỔI, BỔ SUNG MỘT SỐ ĐIỀU CỦA NGHỊ ĐỊNH SỐ 11/2010/NĐ-CP NGÀY 24 THÁNG 02 NĂM 2010 CỦA CHÍNH PHỦ QUY ĐỊNH VỀ QUẢN LÝ VÀ BẢO VỆ KẾT CẤU HẠ TẦNG GIAO THÔNG ĐƯỜNG BỘ"",Nghị định 117/2021/NĐ-CP";;;;
"gt_30,https://vbpl.vn/TW/Pages/vbpq-toanvan.aspx?ItemID=141948,""QUY ĐỊNH DANH MỤC HÀNG HÓA NGUY HIỂM, VẬN CHUYỂN HÀNG HÓA NGUY HIỂM BẰNG PHƯƠNG TIỆN GIAO THÔNG CƠ GIỚI ĐƯỜNG BỘ VÀ VẬN CHUYỂN HÀNG HÓA NGUY HIỂM TRÊN ĐƯỜNG THỦY NỘI ĐỊA"",Nghị định 42/2020/NĐ-CP";;;;
gt_31,https://vbpl.vn/TW/Pages/vbpq-toanvan.aspx?ItemID=140152,QUY ĐỊNH XỬ PHẠT VI PHẠM HÀNH CHÍNH TRONG LĨNH VỰC GIAO THÔNG ĐƯỜNG BỘ VÀ ĐƯỜNG SẮT,Nghị định 100/2019/NĐ-CP;;;;
gt_32,https://vbpl.vn/TW/Pages/vbpq-toanvan.aspx?ItemID=135889,QUY ĐỊNH CHUNG,Nghị định 56/2019/NĐ-CP;;;;
"gt_33,https://vbpl.vn/TW/Pages/vbpq-toanvan.aspx?ItemID=131600,""SỬA ĐỔI, BỔ SUNG MỘT SỐ ĐIỀU CỦA NGHỊ ĐỊNH SỐ 64/2016/NĐ-CP NGÀY 01 THÁNG 7 NĂM 2016 CỦA CHÍNH PHỦ SỬA ĐỔI, BỔ SUNG MỘT SỐ ĐIỀU CỦA NGHỊ ĐỊNH SỐ 11/2010/NĐ-CP NGÀY 24 THÁNG 02 NĂM 2010 QUY ĐỊNH VỀ QUẢN LÝ VÀ BẢO VỆ KẾT CẤU HẠ TẦNG GIAO THÔNG ĐƯỜNG BỘ"",Nghị định 125/2018/NĐ-CP";;;;
gt_34,https://vbpl.vn/TW/Pages/vbpq-toanvan.aspx?ItemID=128858,90 CÔNG BÁO/S,Nghị định 45/2018/NĐ-CP;;;;
gt_35,https://vbpl.vn/TW/Pages/vbpq-toanvan.aspx?ItemID=128322,VỀ VIỆC CÔNG BỐ TUYẾN HÀNG HẢI VÀ PHÂN LUỒNG GIAO THÔNG TRONG LÃNH HẢI VIỆT NAM,Nghị định 16/2018/NĐ-CP;;;;
"gt_36,https://vbpl.vn/TW/Pages/vbpq-toanvan.aspx?ItemID=111319,""SỬA ĐỔI, BỔ SUNG MỘT SỐ ĐIỀU CỦA NGHỊ ĐỊNH SỐ 11/2010/NĐ-CPNGÀY 24 THÁNG 02 NĂM 2010 CỦA CHÍNH PHỦ QUY ĐỊNH VỀ QUẢN LÝVÀ BẢO VỆ KẾT CẤU HẠ TẦNG GIAO THÔNG ĐƯỜNG BỘ"",Nghị định 64/2016/NĐ-CP";;;;
gt_37,https://vbpl.vn/TW/Pages/vbpq-toanvan.aspx?ItemID=105829,QUY ĐỊNH XỬ PHẠT VIPHẠM HÀNH CHÍNH TRONG LĨNH VỰC GIAO THÔNG ĐƯỜNG BỘ VÀ ĐƯỜNG SẮT,Nghị định 46/2016/NĐ-CP;;;;
gt_38,https://vbpl.vn/TW/Pages/vbpq-toanvan.aspx?ItemID=95567,QUY ĐỊNH XỬ PHẠT VI PHẠM HÀNH CHÍNH TRONG LĨNH VỰC GIAO THÔNG ĐƯỜNG THỦY NỘI ĐỊA,Nghị định 132/2015/NĐ-CP;;;;
"gt_39,https://vbpl.vn/TW/Pages/vbpq-toanvan.aspx?ItemID=52566,""QUY ĐỊNH CHI TIẾT VÀ BIỆN PHÁP THI HÀNH MỘT SỐ ĐIỀU CỦA LUẬT GIAO THÔNG ĐƯỜNG THỦY NỘI ĐỊA VÀ LUẬT SỬA ĐỔI, BỔ SUNG MỘT SỐ ĐIỀU CỦA LUẬT GIAO THÔNG ĐƯỜNG THỦY NỘI ĐỊA"",Nghị định 24/2015/NĐ-CP";;;;
"gt_40,https://vbpl.vn/TW/Pages/vbpq-toanvan.aspx?ItemID=37918,""SỬA ĐỔI, BỔ SUNG MỘT SỐ ĐIỀU CỦA NGHỊ ĐỊNH SỐ 171/2013/NĐ-CP NGÀY 13 THÁNG 11 NĂM 2013 CỦA CHÍNH PHỦ QUY ĐỊNH XỬ PHẠT VI PHẠM HÀNH CHÍNH TRONG LĨNH VỰC GIAO THÔNG ĐƯỜNG BỘ VÀ ĐƯỜNG SẮT"",Nghị định 107/2014/NĐ-CP";;;;
gt_41,https://vbpl.vn/TW/Pages/vbpq-toanvan.aspx?ItemID=19476,GIAO THÔNG ĐƯỜNG THUỶ NỘI ĐỊA,Luật 23/2004/QH11;;;;
gt_42,https://vbpl.vn/TW/Pages/vbpq-toanvan.aspx?ItemID=32588,QUY ĐỊNH XỬ PHẠT VI PHẠM HÀNH CHÍNH TRONG LĨNH VỰC GIAO THÔNG ĐƯỜNG BỘ VÀ ĐƯỜNG SẮT,Nghị định 171/2013/NĐ-CP;;;;
"gt_43,https://vbpl.vn/TW/Pages/vbpq-toanvan.aspx?ItemID=32601,""QUY ĐỊNH VIỆC QUẢN LÝ, SỬ DỤNG VÀ DANH MỤC CÁC PHƯƠNG TIỆN, THIẾT BỊ KỸ THUẬT NGHIỆP VỤ ĐƯỢC SỬ DỤNG ĐỂ PHÁT HIỆN VI PHẠM HÀNH CHÍNH VỀ TRẬT TỰ,"",Nghị định 165/2013/NĐ-CP";;;;
gt_44,https://vbpl.vn/TW/Pages/vbpq-toanvan.aspx?ItemID=32543,VỀ VIỆC CÔNG BỐ TUYẾN HÀNG HẢI VÀ PHÂN LUỒNG GIAO THÔNG TRONG LÃNH HẢI VIỆT NAM,Nghị định 146/2013/NĐ-CP;;;;
"gt_45,https://vbpl.vn/TW/Pages/vbpq-toanvan.aspx?ItemID=32074,""SỬA ĐỔI, BỔ SUNG MỘT SỐ ĐIỀU CỦA NGHỊ ĐỊNH SỐ 11/2010/NĐ-CP NGÀY 24 THÁNG 02 NĂM 2010 CỦA CHÍNH PHỦ QUY ĐỊNH VỀ QUẢN LÝ VÀ BẢO VỆ KẾT CẤU HẠ TẦNG GIAO THÔNG ĐƯỜNG BỘ"",Nghị định 100/2013/NĐ-CP";;;;
"gt_46,https://vbpl.vn/TW/Pages/vbpq-toanvan.aspx?ItemID=31731,""QUY ĐỊNH XỬ PHẠT VI PHẠM HÀNH CHÍNH TRONG LĨNH VỰC GIAO THÔNG HÀNG HẢI, ĐƯỜNG THỦY NỘI ĐỊA"",Nghị định 93/2013/NĐ-CP";;;;
gt_47,https://vbpl.vn/TW/Pages/vbpq-toanvan.aspx?ItemID=30513,VỀ TỔ CHỨC VÀ HOẠT ĐỘNG THANH TRA NGÀNH GIAO THÔNG VẬN TẢI,Nghị định 57/2013/NĐ-CP;;;;
"gt_48,https://vbpl.vn/TW/Pages/vbpq-toanvan.aspx?ItemID=28047,""QUY ĐỊNH VIỆC QUẢN LÝ, SỬ DỤNG VÀ KHAI THÁC TÀI SẢN KẾT CẤU HẠ TẦNG GIAO THÔNG ĐƯỜNG BỘ"",Nghị định 10/2013/NĐ-CP";;;;
"gt_49,https://vbpl.vn/TW/Pages/vbpq-toanvan.aspx?ItemID=30333,""QUY ĐỊNH CHỨC NĂNG, NHIỆM VỤ, QUYỀN HẠN VÀ CƠ CẤU TỔ CHỨC CỦA BỘ GIAO THÔNG VẬN TẢI"",Nghị định 107/2012/NĐ-CP";;;;
"gt_50,https://vbpl.vn/TW/Pages/vbpq-toanvan.aspx?ItemID=27795,""SỬA ĐỔI, BỔ SUNG MỘT SỐ ĐIỀU CỦA NGHỊ ĐỊNH SỐ 34/2010/NĐ-CP NGÀY 02 THÁNG 4 NĂM 2010 CỦA CHÍNH PHỦ QUY ĐỊNH XỬ PHẠT VI PHẠM HÀNH CHÍNH TRONG LĨNH VỰC GIAO THÔNG ĐƯỜNG BỘ"",Nghị định 71/2012/NĐ-CP";;;;
gt_51,https://vbpl.vn/TW/Pages/vbpq-toanvan.aspx?ItemID=26689,QUY ĐỊNH XỬ PHẠT VI PHẠM HÀNH CHÍNH TRONG LĨNH VỰC GIAO THÔNG ĐƯỜNG THỦY NỘI ĐỊA,Nghị định 60/2011/NĐ-CP;;;;
"gt_52,https://vbpl.vn/TW/Pages/vbpq-toanvan.aspx?ItemID=26448,""SỬA ĐỔI, BỔ SUNG MỘT SỐ ĐIỀU CỦA NGHỊ ĐỊNH SỐ 34/2010/NĐ-CP NGÀY 02 THÁNG 4 NĂM 2010 CỦA CHÍNH PHỦ QUY ĐỊNH XỬ PHẠT VI PHẠM HÀNH CHÍNH TRONG LĨNH VỰC GIAO THÔNG ĐƯỜNG BỘ"",Nghị định 33/2011/NĐ-CP";;;;
gt_53,https://vbpl.vn/TW/Pages/vbpq-toanvan.aspx?ItemID=25165,QUY ĐỊNH XỬ PHẠT VI PHẠM HÀNH CHÍNH TRONG LĨNH VỰC GIAO THÔNG ĐƯỜNG BỘ,Nghị định 34/2010/NĐ-CP;;;;
"gt_54,https://vbpl.vn/TW/Pages/vbpq-toanvan.aspx?ItemID=25068,""QUY ĐỊNH VIỆC HUY ĐỘNG CÁC LỰC LƯỢNG CẢNH SÁT KHÁC VÀ CÔNG AN XÃ PHỐI HỢP VỚI CẢNH SÁT GIAO THÔNG ĐƯỜNG BỘ THAM GIA TUẦN TRA, KIỂM SOÁT TRẬT TỰ,"",Nghị định 27/2010/NĐ-CP";;;;
gt_55,https://vbpl.vn/TW/Pages/vbpq-toanvan.aspx?ItemID=24966,QUY ĐỊNH VỀ QUẢN LÝ VÀ BẢO VỆ KẾT CẤU HẠ TẦNG GIAO THÔNG ĐƯỜNG BỘ,Nghị định 11/2010/NĐ-CP;;;;
gt_56,https://vbpl.vn/TW/Pages/vbpq-toanvan.aspx?ItemID=23822,QUY ĐỊNH DANH MỤC HÀNG NGUY HIỂM VÀ VẬN CHUYỂN HÀNG NGUY HIỂM BẰNG PHƯƠNG TIỆN GIAO THÔNG CƠ GIỚI ĐƯỜNG BỘ,Nghị định 104/2009/NĐ-CP;;;;
gt_57,https://vbpl.vn/TW/Pages/vbpq-toanvan.aspx?ItemID=23749,QUY ĐỊNH XE Ô TÔ CỦA NGƯỜI NƯỚC NGOÀI ĐĂNG KÝ TẠI NƯỚC NGOÀI CÓ TAY LÁI Ở BÊN PHẢI THAM GIA GIAO THÔNG TẠI VIỆT NAM,Nghị định 80/2009/NĐ-CP;;;;
"gt_58,https://vbpl.vn/TW/Pages/vbpq-toanvan.aspx?ItemID=24586,""SỬA ĐỔI, BỔ SUNG KHOẢN 3 ĐIỀU 42 NGHỊ ĐỊNH SỐ 146/2007/NĐ-CP NGÀY 14 THÁNG 9 NĂM 2007 QUY ĐỊNH XỬ PHẠT VI PHẠM HÀNH CHÍNH TRONG LĨNH VỰC GIAO THÔNG ĐƯỜNG BỘ"",Nghị định 67/2008/NĐ-CP";;;;
"gt_59,https://vbpl.vn/TW/Pages/vbpq-toanvan.aspx?ItemID=12713,""QUY ĐỊNH CHỨC NĂNG, NHIỆM VỤ, QUYỀN HẠN VÀ CƠ CẤU TỔ CHỨC CỦA BỘ GIAO THÔNG VẬN TẢI"",Nghị định 51/2008/NĐ-CP";;;;
"gt_60,https://vbpl.vn/TW/Pages/vbpq-toanvan.aspx?ItemID=13183,""SỬA ĐỔI, BỔ SUNG MỘT SỐ ĐIỀU CỦA NGHỊ ĐỊNH SỐ 09/2005/NĐ-CP NGÀY 27 THÁNG 01 NĂM 2005 CỦA CHÍNH PHỦ QUY ĐỊNH XỬ PHẠT VI PHẠM HÀNH CHÍNH TRONG LĨNH VỰC GIAO THÔNG ĐƯỜNG THỦY NỘI ĐỊA VÀ NGHỊ ĐỊNH SỐ 44/2006/NĐ-CP NGÀY 25 THÁNG 04 NĂM 2006 CỦA CHÍNH PHỦ VỀ VIỆC XỬ PHẠT VI PHẠM HÀNH CHÍNH TRONG LĨNH VỰC GIAO THÔNG VẬN TẢI ĐƯỜNG SẮT"",Nghị định 156/2007/NĐ-CP";;;;
gt_61,https://vbpl.vn/TW/Pages/vbpq-toanvan.aspx?ItemID=23289,GIAO THÔNG ĐƯỜNG BỘ,Luật 26/2001/QH10;;;;
gt_62,https://vbpl.vn/TW/Pages/vbpq-toanvan.aspx?ItemID=13421,QUY ĐỊNH XỬ PHẠT VI PHẠM HÀNH CHÍNH TRONG LĨNH VỰC GIAO THÔNG ĐƯỜNG BỘ,Nghị định 146/2007/NĐ-CP;;;;
gt_63,https://vbpl.vn/TW/Pages/vbpq-toanvan.aspx?ItemID=16231,### VỀ VIỆC XỬ PHẠT VI PHẠM HÀNH CHÍNH TRONG LĨNH VỰC ### GIAO THÔNG VẬN TẢI ĐƯỜNG SẮT,Nghị định 44/2006/NĐ-CP;;;;
gt_64,https://vbpl.vn/TW/Pages/vbpq-toanvan.aspx?ItemID=16905,QUY ĐỊNH VỀ XỬ LÝ VI PHẠM HÀNH CHÍNH TRONG LĨNH VỰC GIAO THÔNG ĐƯỜNG BỘ,Nghị định 152/2005/NĐ-CP;;;;
"gt_65,https://vbpl.vn/TW/Pages/vbpq-toanvan.aspx?ItemID=9158,""VỀ BẢO ĐẢM TRẬT TỰ, AN TOÀN GIAO THÔNG ĐƯỜNG THUỶ NỘI ĐỊA"",Nghị định 40/CP";;;;
"gt_66,https://vbpl.vn/TW/Pages/vbpq-toanvan.aspx?ItemID=9159,""VỀ BẢO ĐẢM TRẬT TỰ, AN TOÀN GIAO THÔNG ĐƯỜNG SẮT"",Nghị định 39/CP";;;;
gt_67,https://vbpl.vn/TW/Pages/vbpq-toanvan.aspx?ItemID=9725,QUY ĐỊNH XỬ PHẠT HÀNH CHÍNH VỀ HÀNH VI VI PHẠM TRẬT TỰ AN TOÀN GIAO THÔNG ĐƯỜNG BỘ,Nghị định 49/CP;;;;
gt_68,https://vbpl.vn/TW/Pages/vbpq-toanvan.aspx?ItemID=30819,VỀ VIỆC QUY ĐỊNH XỬ PHẠT HÀNH CHÍNH VỀ HÀNH VI VI PHẠM TRẬT TỰ AN TOÀN GIAO THÔNG ĐƯỜNG BỘ VÀ TRẬT TỰ AN TOÀN GIAO THÔNG ĐÔ THỊ,Nghị định 49-CP;;;;
gt_69,https://vbpl.vn/TW/Pages/vbpq-toanvan.aspx?ItemID=9899,VỀ BẢO ĐẢM TRẬT TỰ AN TOÀN GIAO THÔNG ĐƯỜNG BỘ VÀ TRẬT TỰ AN TOÀN GIAO THÔNG ĐÔ THỊ,Nghị định 36/CP;;;;
"gt_70,https://vbpl.vn/TW/Pages/vbpq-toanvan.aspx?ItemID=1298,""CỦA HỘI ĐỒNG CHÍNH PHỦ SỐ 120/CP NGÀY 12 THÁNG 8 NĂM 1963 BAN HÀNH ĐIỀU LỆ QUY ĐỊNH PHẠM VI, GIỚI HẠN ĐƯỜNG SẮT"",Nghị định 120-CP";;;;
"gt_71,https://vbpl.vn/TW/Pages/vbpq-toanvan.aspx?ItemID=27000,""VỀ VIỆC KIỆN TOÀN ỦY BAN AN TOÀN GIAO THÔNG QUỐC GIA VÀ BAN AN TOÀN GIAO THÔNG TỈNH, THÀNH PHỐ TRỰC THUỘC TRUNG ƯƠNG"",Quyết định 57/2011/QĐ-TTg";;;;
gt_72,https://vbpl.vn/TW/Pages/vbpq-toanvan.aspx?ItemID=10225,BẢO VỆ CÔNG TRÌNH GIAO THÔNG,Pháp lệnh Không số;;;;
"gt_73,https://vbpl.vn/TW/Pages/vbpq-toanvan.aspx?ItemID=25154,""VỀ VIỆC KIỆN TOÀN ỦY BAN AN TOÀN GIAO THÔNG QUỐC GIA VÀ BAN AN TOÀN GIAO THÔNG TỈNH, THÀNH PHỐ TRỰC THUỘC TRUNG ƯƠNG"",Quyết định 35/2010/QĐ-TTg";;;;
"gt_74,https://vbpl.vn/TW/Pages/vbpq-toanvan.aspx?ItemID=24185,""VỀ VIỆC QUY ĐỊNH MỨC THU, CHẾ ĐỘ THU, NỘP, QUẢN LÝ VÀ SỬ DỤNG PHÍ KIỂM ĐỊNH AN TOÀN GIAO THÔNG VÀ CHẤT LƯỢNG THIẾT BỊ, VẬT TƯ, PHƯƠNG TIỆN GIAO THÔNG ĐƯỜNG SẮT"",Quyết định 34/2008/QĐ-BTC";;;;
gt_75,https://vbpl.vn/TW/Pages/vbpq-toanvan.aspx?ItemID=12760,VỀ VIỆC PHÊ DUYỆT ĐỀ ÁN TĂNG CƯỜNG BẢO ĐẢM TRẬT TỰ AN TOÀN GIAO THÔNG QUỐC GIA ĐẾN NĂM 2010,Quyết định 259/QĐ-TTg;;;;
gt_76,https://vbpl.vn/TW/Pages/vbpq-toanvan.aspx?ItemID=12858,BAN HÀNH QUY ĐỊNH TẠM THỜI VỀ VIỆC SỬ DỤNG CỌC NHỰA ĐỂ PHÂN LÀN XE VÀ CẢNH BÁO AN TOÀN GIAO THÔNG ĐƯỜNG BỘ,Quyết định 01/2008/QĐ-BGTVT;;;;
gt_77,https://vbpl.vn/TW/Pages/vbpq-toanvan.aspx?ItemID=13877,BAN HÀNH QUY ĐỊNH VỀ BỒI DƯỠNG NGHIỆP VỤ AN TOÀN GIAO THÔNG ĐƯỜNG SẮT CHO LỰC LƯỢNG BẢO VỆ TRÊN TÀU HỎA,Quyết định 30/2007/QĐ-BGTVT;;;;
gt_78,https://vbpl.vn/TW/Pages/vbpq-toanvan.aspx?ItemID=13799,BAN HÀNH QUY ĐỊNH VỀ THẨM ĐỊNH AN TOÀN GIAO THÔNG ĐƯỜNG BỘ,Quyết định 23/2007/QĐ-BGTVT;;;;
gt_79,https://vbpl.vn/TW/Pages/vbpq-toanvan.aspx?ItemID=18487,QUY ĐỊNH CHI TIẾT THI HÀNH MỘT SỐ ĐIỀU CỦA LUẬT GIAO THÔNG ĐƯỜNG THỦY NỘI ĐỊA,Nghị định 21/2005/NĐ-CP;;;;
gt_80,https://vbpl.vn/TW/Pages/vbpq-toanvan.aspx?ItemID=18507,QUY ĐỊNH XỬ PHẠT VI PHẠM HÀNH CHÍNH TRONG LĨNH VỰC GIAO THÔNG ĐƯỜNG THỦY NỘI ĐỊA,Nghị định 09/2005/NĐ-CP;;;;
gt_81,https://vbpl.vn/TW/Pages/vbpq-toanvan.aspx?ItemID=18804,## CHÍNH PHỦ,Nghị định 186/2004/NĐ-CP;;;;
gt_82,https://vbpl.vn/TW/Pages/vbpq-toanvan.aspx?ItemID=19677,VỀ TỔ CHỨC VÀ HOẠT ĐỘNG CỦA THANH TRA GIAO THÔNG VẬN TẢI,Nghị định 136/2004/NĐ-CP;;;;
"gt_83,https://vbpl.vn/TW/Pages/vbpq-toanvan.aspx?ItemID=21605,""QUY ĐỊNH CHỨC NĂNG, NHIỆM VỤ, QUYỀN HẠN VÀ CƠ CẤU TỔ CHỨC CỦABỘ GIAO THÔNG VẬN TẢI"",Nghị định 34/2003/NĐ-CP";;;;
gt_84,https://vbpl.vn/TW/Pages/vbpq-toanvan.aspx?ItemID=21769,QUY ĐỊNH CHI TIẾT THI HÀNH MỘT SỐ ĐIỀU CỦA LUẬT GIAO THÔNG ĐƯỜNG BỘ,Nghị định 14/2003/NĐ-CP;;;;
gt_85,https://vbpl.vn/TW/Pages/vbpq-toanvan.aspx?ItemID=21767,### NGHỊ ĐỊNH ##,Nghị định 15/2003/NĐ-CP;;;;
"gt_86,https://vbpl.vn/TW/Pages/vbpq-toanvan.aspx?ItemID=22863,""VỀ ĐIỆU KIỆN KINH DOANH MỘT SỐ NGÀNH, NGHỀ GIAO THÔNG VẬN TẢI ĐƯỜNG THUỶ NỘI ĐỊA"",Nghị định 91/2001/NĐ-CP";;;;
gt_87,https://vbpl.vn/TW/Pages/vbpq-toanvan.aspx?ItemID=5549,NGHỊ ĐỊNH,Nghị định 39/2001/NĐ-CP;;;;
gt_88,https://vbpl.vn/TW/Pages/vbpq-toanvan.aspx?ItemID=23004,VỀ VIỆC BẢO ĐẢM TRẬT TỰ AN TOÀN GIAO THÔNG ĐƯỜNG BỘ VÀ TRẬT TỰ AN TOÀN GIAO THÔNG ĐÔ THỊ,Nghị định 36/2001/NĐ-CP;;;;
"gt_89,https://vbpl.vn/TW/Pages/vbpq-toanvan.aspx?ItemID=173910,""QUY ĐỊNH VỀ ĐIỀU KIỆN KINH DOANH DỊCH VỤ KIỂM ĐỊNH XE CƠ GIỚI"; TỔ CHỨC, HOẠT ĐỘNG CỦA CƠ SỞ ĐĂNG KIỂM;" NIÊN HẠN SỬ DỤNG CỦA XE CƠ GIỚI"",Nghị định 166/2024/NĐ-CP";;
"gt_90,https://vbpl.vn/TW/Pages/vbpq-toanvan.aspx?ItemID=172770,""SỬA ĐỔI, BỔ SUNG MỘT SỐ ĐIỀU CỦA NGHỊ ĐỊNH SỐ 139/2018/NĐ-CP NGÀY 08 THÁNG 10 NĂM 2018 CỦA CHÍNH PHỦ QUY ĐỊNH VỀ KINH DOANH DỊCH VỤ KIỂM ĐỊNH XE CƠ GIỚI, ĐƯỢC SỬA ĐỔI, BỔ SUNG MỘT SỐ ĐIỀU TẠI NGHỊ ĐỊNH SỐ 30/2023/NĐ-CP NGÀY 08 THÁNG 6 NĂM 2023 CỦA CHÍNH PHỦ"",Nghị định 121/2024/NĐ-CP";;;;
"gt_91,https://vbpl.vn/TW/Pages/vbpq-toanvan.aspx?ItemID=164963,""SỬA ĐỔI, BỔ SUNG MỘT SỐ ĐIỀU CỦA NGHỊ ĐỊNH SỐ 139/2018/NĐ-CP NGÀY 08 THÁNG 10 NĂM 2018 CỦA CHÍNH PHỦ QUY ĐỊNH VỀ"",Nghị định 30/2023/NĐ-CP";;;;
gt_92,https://vbpl.vn/TW/Pages/vbpq-toanvan.aspx?ItemID=132391,QUY ĐỊNH VỀ KINH DOANH DỊCH VỤ KIỂM ĐỊNH XE CƠ GIỚI,Nghị định 139/2018/NĐ-CP;;;;
gt_93,https://vbpl.vn/TW/Pages/vbpq-toanvan.aspx?ItemID=111124,QUY ĐỊNH VỀ ĐIỀU KIỆN KINH DOANH DỊCH VỤ KIỂM ĐỊNH XE CƠ GIỚI,Nghị định 63/2016/NĐ-CP;;;;
"gt_94,https://vbpl.vn/TW/Pages/vbpq-toanvan.aspx?ItemID=32874,""SỬA ĐỔI, BỔ SUNG MỘT SỐ ĐIỀU CỦA NGHỊ ĐỊNH SỐ 103/2008/NĐ-CP NGÀY 16 THÁNG 9 NĂM 2008 CỦA CHÍNH PHỦ VỀ BẢO HIỂM BẮT BUỘC"",Nghị định 214/2013/NĐ-CP";;;;
gt_95,https://vbpl.vn/TW/Pages/vbpq-toanvan.aspx?ItemID=12675,VỀ BẢO HIỂM BẮT BUỘC TRÁCH NHIỆM DÂN SỰ CỦA CHỦ XE CƠ GIỚI,Nghị định 103/2008/NĐ-CP;;;;
gt_96,https://vbpl.vn/TW/Pages/vbpq-toanvan.aspx?ItemID=8112,VỀ CHẾ ĐỘ BẢO HIỂM BẮT BUỘC TRÁCH NHIỆM DÂN SỰ CỦA CHỦ XE CƠ GIỚI,Nghị định 115/1997/NĐ-CP;;;;
gt_97,https://vbpl.vn/TW/Pages/vbpq-toanvan.aspx?ItemID=2518,CỦA HỘI ĐỒNG BỘ TRƯỞNG SỐ 30/HĐBT NGÀY 10-3-1988 VỀ CHẾ ĐỘ BẢO HIỂM TRÁCH NHIỆM DÂN SỰ,Nghị định 30/HĐBT;;;;
"gt_98,https://vbpl.vn/TW/Pages/vbpq-toanvan.aspx?ItemID=172481,""QUY ĐỊNH LỘ TRÌNH ÁP DỤNG MỨC TIÊU CHUẨN KHÍ THẢI ĐỐI VỚI XE CƠ GIỚI NHẬP KHẨU VÀ SẢN XUẤT, LẮP RÁP"",Quyết định 19/2024/QĐ-TTg";;;;
"gt_99,https://vbpl.vn/TW/Pages/vbpq-toanvan.aspx?ItemID=24811,""VỀ CẤM VÀ HẠN CHẾ XE CƠ GIỚI BA BÁNH VÀ XE THÔ SƠ BA, BỐN BÁNH LƯU THÔNG TRONG KHU VỰC NỘI ĐÔ VÀ TRÊN CÁC QUỐC LỘ THUỘC ĐỊA BÀN THÀNH PHỐ HỒ CHÍ MINH"",Quyết định 37/2009/QĐ-UBND";;;;
"gt_100,https://vbpl.vn/TW/Pages/vbpq-toanvan.aspx?ItemID=25258,""VỀ VIỆC HỖ TRỢ THAY THẾ XE CÔNG NÔNG"; XE LÔI MÁY; XE CƠ GIỚI BA BÁNH;" XA THÔ SƠ BA, BỐN BÁNH THUỘC DIỆN BỊ ĐÌNH CHỈ THAM GIA GIAO THÔNG"",Quyết định 548/2009/QĐ-TTg";
"ld_1,https://vbpl.vn/TW/Pages/vbpq-toanvan.aspx?ItemID=14837,""SỬA ĐỔI, BỔ SUNG MỘT SỐ ĐIỀU CỦA BỘ LUẬT LAO ĐỘNG"",Luật 74/2006/QH11";;;;
ld_2,https://vbpl.vn/TW/Pages/vbpq-toanvan.aspx?ItemID=46390,QUY ĐỊNH CHI TIẾT MỘT SỐ ĐIỀU CỦA CÔNG ƯỚC LAO ĐỘNG HÀNG HẢI NĂM 2006 VỀ CHẾ ĐỘ LAO ĐỘNG CỦA THUYỀN VIÊN LÀM VIỆC TRÊN TÀU BIỂN,Nghị định 121/2014/NĐ-CP;;;;
"ld_3,https://vbpl.vn/TW/Pages/vbpq-toanvan.aspx?ItemID=22507,""SỬA ĐỔI, BỔ SUNG MỘT SỐ ĐIỀU CỦA BỘ LUẬT LAO ĐỘNG"",Luật 35/2002/QH10";;;;
ld_4,https://vbpl.vn/TW/Pages/vbpq-toanvan.aspx?ItemID=6768,VỀ NGHĨA VỤ LAO ĐỘNG CÔNG ÍCH,Pháp lệnh 15/1999/PL-UBTVQH10;;;;
ld_5,https://vbpl.vn/TW/Pages/vbpq-toanvan.aspx?ItemID=9273,THỦ TỤC GIẢI QUYẾT CÁC TRANH CHẤP LAO ĐỘNG,Pháp lệnh 48-L/CTN;;;;
ld_6,https://vbpl.vn/TW/Pages/vbpq-toanvan.aspx?ItemID=11591,BẢO HỘ LAO ĐỘNG,Pháp lệnh Không số;;;;
ld_7,https://vbpl.vn/TW/Pages/vbpq-toanvan.aspx?ItemID=2058,HỢP ĐỒNG LAO ĐỘNG,Pháp lệnh 45-LCT/HĐNN8;;;;
ld_8,https://vbpl.vn/TW/Pages/vbpq-toanvan.aspx?ItemID=2556,NGHĨA VỤ LAO ĐỘNG CÔNG ÍCH,Pháp lệnh Không số;;;;
ld_9,https://vbpl.vn/TW/Pages/vbpq-toanvan.aspx?ItemID=1224,ĐẶT CÁC DANH HIỆU VINH DỰ NHÀ NƯỚC: ANH HÙNG LAO ĐỘNG VÀ,Pháp lệnh Số hiệu:17/LCT;;;;
ld_10,https://vbpl.vn/TW/Pages/vbpq-toanvan.aspx?ItemID=27615,LAO ĐỘNG,Bộ luật 10/2012/QH13;;;;
ld_11,https://vbpl.vn/TW/Pages/vbpq-toanvan.aspx?ItemID=27614,VỀ VIỆC CÔNG BỐ LUẬT CHỦ TỊCH,Lệnh 08/2012/L-CTN;;;;
"ld_12,https://vbpl.vn/TW/Pages/vbpq-toanvan.aspx?ItemID=22153,""LUẬT SỬA ĐỔI, BỔ SUNG MỘT SỐ ĐIỀU CỦA BỘ LUẬT LAO ĐỘNG"",Lệnh 08/2002/L-CTN";;;;
ld_13,https://vbpl.vn/TW/Pages/vbpq-toanvan.aspx?ItemID=6769,VỀ VIỆC CÔNG BỐ PHÁP LỆNH NGHĨA VỤ LAO ĐỘNG CÔNG ÍCH,Lệnh 07/L-CTN;;;;
ld_14,https://vbpl.vn/TW/Pages/vbpq-toanvan.aspx?ItemID=6138,CÔNG BỐ BỘ LUẬT LAO ĐỘNG CỦA NƯỚC CỘNG HÒA XÃ HỘI CHỦ NGHĨA VIỆT NAM,Lệnh 05-L/CTN;;;;
"ld_15,https://vbpl.vn/TW/Pages/vbpq-toanvan.aspx?ItemID=177292,""VỀ VIỆC THỰC HIỆN LIÊN TỤC CHẾ ĐỘ KHOÁN HỌP ĐỐI VỚI ĐẠI BIỂU QUỐC HỘIHOẠT ĐỘNG CHUYÊN TRÁCH";" CHẾ ĐỘ KHOÁN CHI PHỤC VỤ HOẠT ĐỘNG CỦA QUỐC HỘIĐỐI VỚI CÁN BỘ, CÔNG CHỨC, VIÊN CHỨC, NGƯỜI LAO ĐỘNG THUỘC CÁC CƠ QUAN CỦAQUỐC HỘI, CƠ QUAN THUỘC ỦY BAN THƯỜNG VỤ QUỐC HỘI, VĂN PHÒNG QUỐC HỘI"",Nghị quyết 47/2024/UBTVQH15";;;
"ld_16,https://vbpl.vn/TW/Pages/vbpq-toanvan.aspx?ItemID=162537,""THÍ ĐIỂM MÔ HÌNH TỔ CHỨC HOẠT ĐỘNG LAO ĐỘNG, HƯỚNG NGHIỆP, DẠY NGHỀ CHO PHẠM NHÂN NGOÀI TRẠI GIAM"",Nghị quyết 54/2022/QH15";;;;
"ld_17,https://vbpl.vn/TW/Pages/vbpq-toanvan.aspx?ItemID=137746,""NGHỊ QUYẾT NÀY HƯỚNG DẪN ÁP DỤNG MỘT SỐ QUY ĐỊNH TẠI ĐIỀU 214 VỀ TỘI GIAN LẬN BẢO HIỂM XÃ HỘI, BẢO HIỂM THẤT NGHIỆP, ĐIỀU 215 VỀ TỘI GIAN LẬN BẢO HIỂM Y TẾ VÀ ĐIỀU 216 VỀ TỘI TRỐN ĐÓNG BẢO HIỂM XÃ HỘI, BẢO HIỂM Y TẾ, BẢO HIỂM THẤT NGHIỆP CHO NGƯỜI LAO ĐỘNG CỦA BỘ LUẬT HÌNH SỰ."",Nghị quyết 05/2019/NQ-HĐTP";;;;
