DocumentID,Source,Content,Number;;;;
ds_1,https://vbpl.vn/TW/Pages/vbpq-toanvan.aspx?ItemID=96115,TỐ TỤNG DÂN SỰ,Bộ luật 92/2015/QH13;;;;
"ds_2,https://vbpl.vn/TW/Pages/vbpq-toanvan.aspx?ItemID=179420,""SỬA ĐỔI, BỔ SUNG MỘT SỐ ĐIỀU CỦA BỘ LUẬT TỐ TỤNG DÂN SỰ, LUẬT TỐ TỤNG HÀNH CHÍNH,"",Luật 85/2025/QH15";;;;
ds_3,https://vbpl.vn/TW/Pages/vbpq-toanvan.aspx?ItemID=167216,PHÒNG THỦ DÂN SỰ,Luật 18/2023/QH15;;;;
"ds_4,https://vbpl.vn/TW/Pages/vbpq-toanvan.aspx?ItemID=152951,""SỬA ĐỔI, BỔ SUNG MỘT SỐ ĐIỀU CỦA LUẬT ĐẦU TƯ CÔNG, ĐẦU TƯ THEO PHƯƠNG THỨC ĐỐI TÁC CÔNG TƯ,"",Luật 03/2022/QH15";;;;
"ds_5,https://vbpl.vn/TW/Pages/vbpq-toanvan.aspx?ItemID=46740,""SỬA ĐỔI, BỔ SUNG MỘT SỐ ĐIỀU CỦA LUẬT THI HÀNH ÁN DÂN SỰ"",Luật 64/2014/QH13";;;;
"ds_6,https://vbpl.vn/TW/Pages/vbpq-toanvan.aspx?ItemID=26674,""SỬA ĐỔI, BỔ SUNG MỘT SỐ ĐIỀU CỦA BỘ LUẬT TỐ TỤNG DÂN SỰ"",Luật 65/2011/QH12";;;;
ds_7,https://vbpl.vn/TW/Pages/vbpq-toanvan.aspx?ItemID=12318,THI HÀNH ÁN DÂN SỰ,Luật 26/2008/QH12;;;;
ds_8,https://vbpl.vn/TW/Pages/vbpq-toanvan.aspx?ItemID=19408,VỀ THI HÀNH ÁN DÂN SỰ,Pháp lệnh 13/2004/PL-UBTVQH11;;;;
ds_9,https://vbpl.vn/TW/Pages/vbpq-toanvan.aspx?ItemID=95942,DÂN SỰ,Bộ luật 91/2015/QH13;;;;
ds_10,https://vbpl.vn/TW/Pages/vbpq-toanvan.aspx?ItemID=10814,THI HÀNH ÁN DÂN SỰ,Pháp lệnh Không số;;;;
"ds_11,https://vbpl.vn/TW/Pages/vbpq-toanvan.aspx?ItemID=10815,""CÔNG NHẬN VÀ THI HÀNH TẠI VIỆT NAM BẢN ÁN, QUYẾT ĐỊNH DÂN SỰ CỦA TOÀ ÁN NƯỚC NGOÀI"",Pháp lệnh Không số";;;;
ds_12,https://vbpl.vn/TW/Pages/vbpq-toanvan.aspx?ItemID=11599,HỢP ĐỒNG DÂN SỰ,Pháp lệnh Không số;;;;
ds_13,https://vbpl.vn/TW/Pages/vbpq-toanvan.aspx?ItemID=2306,THỦ TỤC GIẢI QUYẾT CÁC VỤ ÁN DÂN SỰ,Pháp lệnh 27-LCT/HĐNN8;;;;
ds_14,https://vbpl.vn/TW/Pages/vbpq-toanvan.aspx?ItemID=2311,THI HÀNH ÁN DÂN SỰ,Pháp lệnh 23-LCT/HĐNN8;;;;
ds_15,https://vbpl.vn/TW/Pages/vbpq-toanvan.aspx?ItemID=70292,VỀ VIỆC CÔNG BỐ LUẬT CHỦ TỊCH,Lệnh 26/2014/L-CTN;;;;
"ds_16,https://vbpl.vn/TW/Pages/vbpq-toanvan.aspx?ItemID=6629,""CỦA CHỦ TỊCH NƯỚC SỐ: 14/L-CTN NGÀY 26-4-1993 CÔNG BỐ PHÁP LỆNH CÔNG NHẬN TẠI VÀ THI HÀNH TẠI VIỆT NAM BẢN ÁN, QUYẾT ĐỊNH DÂN SỰ CỦA TOÀ ÁN NƯỚC NGOÀI"",Lệnh 14/L-CTN";;;;
ds_17,https://vbpl.vn/TW/Pages/vbpq-toanvan.aspx?ItemID=6630,CỦA CHỦ TỊCH NƯỚC SỐ 12-L/CTN NGÀY 26/4/1993 CÔNG BỐ PHÁP LỆNH TỔ CHỨC VIỆN KIỂM SÁT QUÂN SỰ,Lệnh 13/L-CTN;;;;
ds_18,https://vbpl.vn/TW/Pages/vbpq-toanvan.aspx?ItemID=167688,HƯỚNG DẪN ÁP DỤNG MỘT SỐ QUY ĐỊNH CỦA BỘ LUẬT DÂN SỰ VỀ TRÁCH NHIỆM BỒI THƯỜNG THIỆT HẠI NGOÀI HỢP ĐỒNG HỘI ĐỒNG THẨM PHÁN TÒA ÁN NHÂN DÂN TỐI CAO,Nghị quyết Số: 02/2022/NQ-HĐTP;;;;
ds_19,https://vbpl.vn/TW/Pages/vbpq-toanvan.aspx?ItemID=151626,HỘI ĐỒNG THẨM PHÁN TÒA ÁN NHÂN DÂN TỐI CAO,Nghị quyết 01/2021/NQ-HĐTP;;;;
ds_20,https://vbpl.vn/TW/Pages/vbpq-toanvan.aspx?ItemID=18128,DÂN SỰ,Bộ luật 33/2005/QH11;;;;
ds_21,https://vbpl.vn/TW/Pages/vbpq-toanvan.aspx?ItemID=167690,HƯỚNG DẪN ÁP DỤNG ĐIỀU 201 CỦA BỘ LUẬT HÌNH SỰ VÀ VIỆC XÉT XỬ VỤ ÁN HÌNH SỰ VỀ TỘI CHO VAY LÃI NẶNG TRONG GIAO DỊCH DÂN SỰ HỘI ĐỒNG THẨM PHÁN TÒA ÁN NHÂN DÂN TỐI CAO,Nghị quyết Số: 01/2021/NQ-HĐTP;;;;
ds_22,https://vbpl.vn/TW/Pages/vbpq-toanvan.aspx?ItemID=147587,NGHỊ QUYẾT NÀY HƯỚNG DẪN MỘT SỐ QUY ĐỊNH VỀ CÁC BIỆN PHÁP KHẨN CẤP TẠM THỜI CỦA BỘ LUẬT TỐ TỤNG DÂN SỰ SỐ 92/2015/QH13 NGÀY 25 THÁNG 11 NĂM 2015 (SAU ĐÂY GỌI TẮT LÀ BỘ LUẬT TỐ TỤNG DÂN SỰ).,Nghị quyết 02/2020/NQ-HĐTP;;;;
ds_23,https://vbpl.vn/TW/Pages/vbpq-toanvan.aspx?ItemID=153951,1. NGHỊ QUYẾT NÀY ĐÃ ĐƯỢC HỘI ĐỒNG THẨM PHÁN TÒA ÁN NHÂN DÂN TỐI CAO THÔNG QUA NGÀY 09 THÁNG 8 NĂM 2018 VÀ CÓ HIỆU LỰC THI HÀNH KỂ TỪ NGÀY 01 THÁNG 10 NĂM 2018.,Nghị quyết 04/2018/NQ-HĐTP;;;;
"ds_24,https://vbpl.vn/TW/Pages/vbpq-toanvan.aspx?ItemID=121554,""HƯỚNG DẪN MỘT SỐ QUY ĐỊNH TẠI KHOẢN 1 VÀ KHOẢN 3 ĐIỀU 192 BỘ LUẬT TỐ TỤNG DÂN SỰ SỐ 92/2015/QH13 VỀ TRẢ LẠI ĐƠN KHỞI KIỆN, QUYỀN NỘP ĐƠN KHỞI KIỆN LẠI VỤ ÁN HỘI ĐỒNG THẨM PHÁN TÒA ÁN NHÂN DÂN TỐI CAO"",Nghị quyết 04/2017/NQ-HĐTP";;;;
ds_25,https://vbpl.vn/TW/Pages/vbpq-toanvan.aspx?ItemID=153920,NGHỊ QUYẾT NÀY ĐÃ ĐƯỢC HỘI ĐỒNG THẨM PHÁN TÒA ÁN NHÂN DÂN TỐI CAO THÔNG QUA NGÀY 06 THÁNG 01 NĂM 2017 VÀ CÓ HIỆU LỰC THI HÀNH KỂ TỪ NGÀY 24 THÁNG 02 NĂM 2017.,Nghị quyết 01/2017/NQ-HĐTP;;;;
ds_26,https://vbpl.vn/TW/Pages/vbpq-toanvan.aspx?ItemID=153919,QUY ĐỊNH CHUNG,Nghị quyết 04/2016/NQ-HĐTP;;;;
ds_27,https://vbpl.vn/TW/Pages/vbpq-toanvan.aspx?ItemID=121224,HƯỚNG DẪN THI HÀNH MỘT SỐ QUY ĐỊNH CỦA NGHỊ QUYẾT SỐ 103/2015/QH13 NGÀY 25-11-2015 CỦA QUỐC HỘI VỀ VIỆC THI HÀNH BỘ LUẬT TỐ TỤNG DÂN SỰ VÀ NGHỊ QUYẾT SỐ 104/2015/QH13 NGÀY 25-11-2015 CỦA QUỐC HỘI VỀ VIỆC THI HÀNH LUẬT TỐ TỤNG HÀNH CHÍNH HỘI ĐỒNG THẨM PHÁN TÒA ÁN NHÂN DÂN TỐI CAO,Nghị quyết 02/2016/NQ-HĐTP;;;;
ds_28,https://vbpl.vn/TW/Pages/vbpq-toanvan.aspx?ItemID=153918,KỂ TỪ NGÀY BỘ LUẬT TỐ TỤNG DÂN SỰ SỐ 92/2015/QH13 CÓ HIỆU LỰC THI HÀNH (NGÀY 01 THÁNG 7 NĂM 2016):,Nghị quyết 103/2015/QH13;;;;
ds_29,https://vbpl.vn/TW/Pages/vbpq-toanvan.aspx?ItemID=46783,VỀ VIỆC TỔ CHỨC LẤY Ý KIẾN NHÂN DÂN ĐỐI VỚI DỰ THẢO BỘ LUẬT DÂN SỰ (SỬA ĐỔI),Nghị quyết 857/NQ-UBTVQH13;;;;
"ds_30,https://vbpl.vn/TW/Pages/vbpq-toanvan.aspx?ItemID=68058,""HƯỚNG DẪN THI HÀNH MỘT SỐ QUY ĐỊNH CỦA NGHỊ QUYẾT SỐ 60/2011/QH12 NGÀY 29 THÁNG 3 NĂM 2011 CỦA QUỐC HỘI VỀ VIỆC THI HÀNH LUẬT SỬA ĐỔI, BỔ SUNG MỘT SỐ ĐIỀU CỦA BỘ LUẬT TỐ TỤNG DÂN SỰ"",Nghị quyết 02/2012/NQ-HĐTP";;;;
"ds_31,https://vbpl.vn/TW/Pages/vbpq-toanvan.aspx?ItemID=30607,""HƯỚNG DẪN THI HÀNH MỘT SỐ QUY ĐỊNH TRONG PHẦN THỨ HAI“THỦ TỤC GIẢI QUYẾT VỤ ÁN TẠI TÒA ÁN CẤP SƠ THẨM” CỦA BỘ LUẬT TỐ TỤNG DÂN SỰ ĐÃ ĐƯỢC SỬA ĐỔI, BỔ SUNG THEO"",Nghị quyết 05/2012/NQ-HĐTP";;;;
"ds_32,https://vbpl.vn/TW/Pages/vbpq-toanvan.aspx?ItemID=30606,""HƯỚNG DẪN THI HÀNH MỘT SỐ QUY ĐỊNH VỀ “CHỨNG MINH VÀ CHỨNG CỨ” CỦA BỘ LUẬT TỐ TỤNG DÂN SỰ ĐÃ ĐƯỢC SỬA ĐỔI, BỔ SUNG THEO LUẬT SỬA ĐỔI,"",Nghị quyết 04/2012/NQ-HĐTP";;;;
ds_33,https://vbpl.vn/TW/Pages/vbpq-toanvan.aspx?ItemID=30610,HƯỚNG DẪN THI HÀNH MỘT SỐ QUY ĐỊNH TRONG PHẦN THỨ BA “THỦ TỤC GIẢI QUYẾT VỤ ÁN TẠITÒA ÁN CẤP PHÚC THẨM” CỦA BỘ LUẬTTỐ TỤNG DÂN SỰ,Nghị quyết 06/2012/NQ-HĐTP;;;;
ds_34,https://vbpl.vn/TW/Pages/vbpq-toanvan.aspx?ItemID=36686,CÒN HIỆU LỰC 01/07/2013,Nghị quyết 03/2012/NQ-HĐTP;;;;
"ds_35,https://vbpl.vn/TW/Pages/vbpq-toanvan.aspx?ItemID=26675,""VỀ VIỆC THI HÀNH LUẬT SỬA ĐỔI, BỔ SUNG MỘT SỐ ĐIỀU CỦA BỘ LUẬT TỐ TỤNG DÂN SỰ"",Nghị quyết 60/2011/QH12";;;;
"ds_36,https://vbpl.vn/TW/Pages/vbpq-toanvan.aspx?ItemID=12055,""VỀ VIỆC GIAO THẨM QUYỀN XÉT XỬ CÁC VỤ ÁN HÌNH SỰ QUY ĐỊNH TẠI KHOẢN 1 ĐIỀU 170 CỦA BỘ LUẬT TỐ TỤNG HÌNH SỰ VÀ THẨM QUYỀN GIẢI QUYẾT CÁC VỤ VIỆC DÂN SỰ QUY ĐỊNH TẠI ĐIỀU 33 CỦA BỘ LUẬT TỐ TỤNG DÂN SỰ CHO CÁC TÒA ÁN NHÂN DÂN HUYỆN, QUẬN, THỊ XÃ, THÀNH PHỐ THUỘC TỈNH"",Nghị quyết 781/2009/UBTVQH12";;;;
"ds_37,https://vbpl.vn/TW/Pages/vbpq-toanvan.aspx?ItemID=12525,""VỀ VIỆC GIAO THẨM QUYỀN XÉT XỬ CÁC VỤ ÁN HÌNH SỰ QUY ĐỊNH TẠI KHOẢN 1 ĐIỀU 170 CỦA BỘ LUẬT TỐ TỤNG HÌNH SỰ VÀ THẨM QUYỀN GIẢI QUYẾT CÁC VỤ VIỆC DÂN SỰ QUY ĐỊNH TẠI ĐIỀU 33 CỦA BỘ LUẬT TỐ TỤNG DÂN SỰ CHO CÁC TÒA ÁN NHÂN DÂN HUYỆN, QUẬN, THỊ XÃ, THÀNH PHỐ THUỘC TỈNH"",Nghị quyết 720/2008/UBTVQH12";;;;
ds_38,https://vbpl.vn/TW/Pages/vbpq-toanvan.aspx?ItemID=12319,VỀ VIỆC THI HÀNH LUẬT THI HÀNH ÁN DÂN SỰ,Nghị quyết 24/2008/QH12;;;;
"ds_39,https://vbpl.vn/TW/Pages/vbpq-toanvan.aspx?ItemID=13194,""VỀ VIỆC GIAO THẨM QUYỀN XÉT XỬ CÁC VỤ ÁN HÌNH SỰ QUY ĐỊNH TẠI KHOẢN 1 ĐIỀU 170 CỦA BỘ LUẬT TỐ TỤNG HÌNH SỰ VÀ THẨM QUYỀN GIẢI QUYẾT CÁC VỤ VIỆC DÂN SỰ QUY ĐỊNH TẠI ĐIỀU 33 CỦA BỘ LUẬT TỐ TỤNG DÂN SỰ CHO CÁC TOÀ ÁN NHÂN DÂN HUYỆN, QUẬN, THỊ XÃ, THÀNH PHỐ THUỘC TỈNH"",Nghị quyết 293A/2007/UBTVQH12";;;;
ds_40,https://vbpl.vn/TW/Pages/vbpq-toanvan.aspx?ItemID=19482,TỐ TỤNG DÂN SỰ,Bộ luật 24/2004/QH11;;;;
ds_41,https://vbpl.vn/TW/Pages/vbpq-toanvan.aspx?ItemID=15535,HƯỚNG DẪN THI HÀNH MỘT SỐ QUY ĐỊNH TRONG PHẦN THỨ BA “THỦ TỤC GIẢI QUYẾT VỤ ÁN TẠI TOÀ ÁN CẤP PHÚC THẨM” CỦA BỘ LUẬT TỐ TỤNG DÂN SỰ,Nghị quyết 05/2006/NQ-HĐTP;;;;
ds_42,https://vbpl.vn/TW/Pages/vbpq-toanvan.aspx?ItemID=15659,VỀ VIỆC GIAO THẨM QUYỀN XÉT XỬ CÁC VỤ ÁN HÌNH SỰ QUY ĐỊNH TẠI KHOẢN 1,Nghị quyết 1036/2006/NQ-UBTVQH11;;;;
ds_43,https://vbpl.vn/TW/Pages/vbpq-toanvan.aspx?ItemID=15517,VỀ GIAO DỊCH DÂN SỰ VỀ NHÀ Ở ĐƯỢC XÁC LẬP TRƯỚC NGÀY 01 THÁNG 07 NĂM 1991 CÓ NGƯỜI VIỆT NAM ĐỊNH CƯ Ở NƯỚC NGOÀI THAM GIA,Nghị quyết 1037/2006/NQ-UBTVQH11;;;;
ds_44,https://vbpl.vn/TW/Pages/vbpq-toanvan.aspx?ItemID=15588,HƯỚNG DẪN ÁP DỤNG MỘT SỐ QUY ĐỊNH CỦA BỘ LUẬT DÂN SỰ NĂM 2005 VỀ BỒI THƯỜNG THIỆT HẠI NGOÀI HỢP ĐỒNG,Nghị quyết 03/2006/NQ-HĐTP;;;;
ds_45,https://vbpl.vn/TW/Pages/vbpq-toanvan.aspx?ItemID=15930,NGHỊ QUYẾ HƯỚNG DẪN THI HÀNH CÁC QUY ĐỊNH TRONG PHẦN THỨ HAI,Nghị quyết 02/2006/NQ-HĐTP;;;;
"ds_46,https://vbpl.vn/TW/Pages/vbpq-toanvan.aspx?ItemID=17448,""HƯỚNG DẪN THI HÀNH MỘT SỐ QUY ĐỊNH CỦA BỘ LUẬT TỐ TỤNG DÂN SỰ VỀ """"CHỨNG MINH VÀ CHỨNG CỨ"""""",Nghị quyết 04/2005/NQ-HĐTP";;;;
ds_47,https://vbpl.vn/TW/Pages/vbpq-toanvan.aspx?ItemID=74176,VỀ VIỆC THI HÀNH BỘ LUẬT DÂN SỰ,Nghị quyết 45/2005/NQ-QH11;;;;
ds_48,https://vbpl.vn/TW/Pages/vbpq-toanvan.aspx?ItemID=17593,VỀ VIỆC THI HÀNH BỘ LUẬT DÂN SỰ,Nghị quyết 45/2005/QH11;;;;
ds_49,https://vbpl.vn/TW/Pages/vbpq-toanvan.aspx?ItemID=18288,THẨM PHÁN TOÀ ÁN NHÂN DÂN TỐI CAO HƯỚNG DẪN THI HÀNH MỘT SỐ QUY ĐỊNH TẠI CHƯƠNG VIII,Nghị quyết 02/2005/NQ-HĐTP;;;;
"ds_50,https://vbpl.vn/TW/Pages/vbpq-toanvan.aspx?ItemID=16114,""HƯỚNG DẪN THI HÀNH MỘT SỐ QUY ĐỊNH TRONG PHẦN THỨ NHẤT """"NHỮNG QUY ĐỊNH CHUNG"""" CỦA BỘ LUẬT TỐ TỤNG DÂN SỰ NĂM 2004"",Nghị quyết 01/2005/NQ-HĐTP";;;;
"ds_51,https://vbpl.vn/TW/Pages/vbpq-toanvan.aspx?ItemID=15833,""VỀ VIỆC GIAO THẨM QUYỀN GIẢI QUYẾT CÁC VỤ VIỆC DÂN SỰ QUY ĐỊNH TẠI ĐIỀU 33 CỦA BỘ LUẬT TỐ TỤNG DÂN SỰ CHO CÁC TOÀ ÁN NHÂN DÂN HUYỆN, QUẬN, THỊ XÃ, THÀNH PHỐ THUỘC TỈNH"",Nghị quyết 742/2004/NQ-UBTVQH11";;;;
"ds_52,https://vbpl.vn/TW/Pages/vbpq-toanvan.aspx?ItemID=16333,""HƯỚNG DẪN ÁP DỤNG PHÁP LUẬT TRONG VIỆC GIẢI QUYẾT CÁC VỤ ÁN DÂN SỰ, HÔN NHÂN VÀ GIA ĐÌNH"",Nghị quyết 02/2004/NQ-HĐTP";;;;
ds_53,https://vbpl.vn/TW/Pages/vbpq-toanvan.aspx?ItemID=9683,DÂN SỰ LỜI NÓI ĐẦU,Bộ luật Không số;;;;
ds_54,https://vbpl.vn/TW/Pages/vbpq-toanvan.aspx?ItemID=19390,VỀ VIỆC THI HÀNH BỘ LUẬT TỐ TỤNG DÂN SỰ,Nghị quyết 32/2004/QH11;;;;
ds_55,https://vbpl.vn/TW/Pages/vbpq-toanvan.aspx?ItemID=19469,HƯỚNG DẪN ÁP DỤNG MỘT SỐ QUY ĐỊNH CỦA BỘ LUẬT DÂN SỰ VỀ BỒI THƯỜNG THIỆT HẠI NGOÀI HỢP ĐỒNG,Nghị quyết 01/2004/NQ-HĐTP;;;;
ds_56,https://vbpl.vn/TW/Pages/vbpq-toanvan.aspx?ItemID=19859,THẨM PHÁN TOÀ ÁN NHÂN DÂN TỐI CAO HƯỚNG DẪN ÁP DỤNG PHÁP LUẬT TRONG VIỆC GIẢI QUYẾT,Nghị quyết 01/2003/NQ-HĐTP;;;;
ds_57,https://vbpl.vn/TW/Pages/vbpq-toanvan.aspx?ItemID=7556,VỀ GIAO DỊCH DÂN SỰ VỀ NHÀ Ở ĐƯỢC XÁC LẬP TRƯỚC NGÀY 1 THÁNG 7 NĂM 1991,Nghị quyết 58/1998/NQ-UBTVQH10;;;;
ds_58,https://vbpl.vn/TW/Pages/vbpq-toanvan.aspx?ItemID=9707,VỀ VIỆC THI HÀNH BỘ LUẬT DÂN SỰ,Nghị quyết Không số;;;;
"ds_59,https://vbpl.vn/TW/Pages/vbpq-toanvan.aspx?ItemID=2797,""PHÊ CHUẨN HIỆP ĐỊNH TƯƠNG TRỢ TƯ PHÁP VỀ CÁC VẤN ĐỀ DÂN SỰ, GIA ĐÌNH VÀ HÌNH SỰ GIỮA VIỆT NAM VÀ BUN-GA-RI"",Nghị quyết 784/NQ-HĐNN7";;;;
ds_60,https://vbpl.vn/TW/Pages/vbpq-toanvan.aspx?ItemID=3279,CỦA HỘI ĐỒNG NHÀ NƯỚC SỐ 615-NQ/HĐNN7 NGÀY 26 THÁNG 3 NĂM 1985,Nghị quyết 615-NQ/HĐNN7;;;;
ds_61,https://vbpl.vn/TW/Pages/vbpq-toanvan.aspx?ItemID=3278,CỦA HỘI ĐỒNG NHÀ NƯỚC SỐ 616-NQ/HĐNN7 NGÀY 26 THÁNG 3 NĂM 1985,Nghị quyết 616-NQ/HĐNN7;;;;
ds_62,https://vbpl.vn/TW/Pages/vbpq-toanvan.aspx?ItemID=3638,CỦA HỘI ĐỒNG NHÀ NƯỚC SỐ 324/NQ-HĐNN7 NGÀY 30 THÁNG 3 NĂM 1983,Nghị quyết 324/NQ-HĐNN7;;;;
ds_63,https://vbpl.vn/TW/Pages/vbpq-toanvan.aspx?ItemID=3869,CỦA HỘI ĐỒNG NHÀ NƯỚC SỐ 103/NQ-HĐNN7 NGÀY 22 THÁNG 1 NĂM 1982,Nghị quyết 103-NQ/HĐNN7;;;;
"ds_64,https://vbpl.vn/TW/Pages/vbpq-toanvan.aspx?ItemID=180096,""QUY ĐỊNH VỀ HOẠT ĐỘNG MẬT MÃ DÂN SỰ VÀ SỬA ĐỔI, BỔ SUNG MỘT SỐ ĐIỀU CỦA NGHỊ ĐỊNH SỐ 15/2020/NĐ-CP NGÀY 03 THÁNG 02 NĂM 2020 CỦA CHÍNH PHỦ QUY ĐỊNH XỬ PHẠT VI PHẠM HÀNH CHÍNH TRONG LĨNH VỰC BƯU CHÍNH, VIỄN THÔNG, TẦN SỐ VÔ TUYẾN ĐIỆN, CÔNG NGHỆ THÔNG TIN VÀ GIAO DỊCH ĐIỆN TỬ ĐƯỢC SỬA ĐỔI, BỔ SUNG MỘT SỐ ĐIỀU TẠI NGHỊ ĐỊNH SỐ 14/2022/NĐ-CP NGÀY 27 THÁNG 01 NĂM 2022 CỦA CHÍNH PHỦ"",Nghị định 211/2025/NĐ-CP";;;;
ds_65,https://vbpl.vn/TW/Pages/vbpq-toanvan.aspx?ItemID=179784,QUY ĐỊNH CHI TIẾT MỘT SỐ ĐIỀU CỦA LUẬT PHÒNG THỦ DÂN SỰ,Nghị định 200/2025/NĐ-CP;;;;
"ds_66,https://vbpl.vn/TW/Pages/vbpq-toanvan.aspx?ItemID=171896,""SỬA ĐỔI, BỔ SUNG MỘT SỐ ĐIỀU CỦA NGHỊ ĐỊNH SỐ 62/2015/NĐ-CP NGÀY 18 THÁNG 7 NĂM 2015 QUY ĐỊNH CHI TIẾT VÀ HƯỚNG DẪN THI HÀNH MỘT SỐ ĐIỀU CỦA LUẬT THI HÀNH ÁN DÂN SỰ ĐƯỢC SỬA ĐỔI, BỔ SUNG MỘT SỐ ĐIỀU THEO NGHỊ ĐỊNH SỐ 33/2020/NĐ-CP NGÀY 17 THÁNG 3 NĂM 2020 CỦA CHÍNH PHỦ"",Nghị định 152/2024/NĐ-CP";;;;
"ds_67,https://vbpl.vn/TW/Pages/vbpq-toanvan.aspx?ItemID=170131,""SỬA ĐỔI, BỔ SUNG MỘT SỐ ĐIỀU CỦA NGHỊ ĐỊNH SỐ 82/2020/NĐ-CP NGÀY 15 THÁNG 7 NĂM 2020 CỦA CHÍNH PHỦ QUY ĐỊNH XỬ PHẠT VI PHẠM"",Nghị định 117/2024/NĐ-CP";;;;
"ds_68,https://vbpl.vn/TW/Pages/vbpq-toanvan.aspx?ItemID=160811,""SỬA ĐỔI, BỔ SUNG NGHỊ ĐỊNH SỐ 53/2018/NĐ-CP NGÀY 16 THÁNG 4 NĂM 2018 CỦA CHÍNH PHỦ SỬA ĐỔI, BỔ SUNG NGHỊ ĐỊNH SỐ 58/2016/NĐ-CP NGÀY 01 THÁNG 7 NĂM 2016 CỦA CHÍNH PHỦ QUY ĐỊNH CHI TIẾT VỀ KINH DOANH SẢN PHẨM, DỊCH VỤ MẬT MÃ DÂN SỰ VÀ XUẤT KHẨU, NHẬP KHẨU SẢN PHẨM MẬT MÃ DÂN SỰ"",Nghị định 32/2023/NĐ-CP";;;;
ds_69,https://vbpl.vn/TW/Pages/vbpq-toanvan.aspx?ItemID=147004,QUY ĐỊNH THI HÀNH BỘ LUẬT DÂN SỰ VỀ BẢO ĐẢM THỰC HIỆN NGHĨA VỤ,Nghị định 21/2021/NĐ-CP;;;;
"ds_70,https://vbpl.vn/TW/Pages/vbpq-toanvan.aspx?ItemID=141444,""SỬA ĐỔI, BỔ SUNG MỘT SỐ ĐIỀU CỦA NGHỊ ĐỊNH SỐ 62/2015/NĐ-CP NGÀY 18 THÁNG 7 NĂM 2015 CỦA CHÍNH PHỦ QUY ĐỊNH CHI TIẾT"",Nghị định 33/2020/NĐ-CP";;;;
ds_71,https://vbpl.vn/TW/Pages/vbpq-toanvan.aspx?ItemID=133483,VỀ PHÒNG THỦ DÂN SỰ,Nghị định 02/2019/NĐ-CP;;;;
ds_72,https://vbpl.vn/TW/Pages/vbpq-toanvan.aspx?ItemID=185946,TƯƠNG TRỢ TƯ PHÁP VỀ DÂN SỰ,Luật 102/2025/QH15;;;;
"ds_73,https://vbpl.vn/TW/Pages/vbpq-toanvan.aspx?ItemID=137224,""SỬA ĐỔI, BỔ SUNG NGHỊ ĐỊNH SỐ 58/2016/NĐ-CP NGÀY 01 THÁNG 7 NĂM 2016 CỦA CHÍNH PHỦ QUY ĐỊNH CHI TIẾT VỀ KINH DOANH SẢN PHẨM, DỊCH VỤ MẬT MÃ DÂN SỰ VÀ XUẤT KHẨU, NHẬP KHẨU SẢN PHẨM MẬT MÃ DÂN SỰ"",Nghị định 53/2018/NĐ-CP";;;;
"ds_74,https://vbpl.vn/TW/Pages/vbpq-toanvan.aspx?ItemID=75724,""SỬA ĐỔI, BỔ SUNG MỘT SỐ ĐIỀU CỦA NGHỊ ĐỊNH SỐ 110/2013/NĐ-CP NGÀY 24 THÁNG 9 NĂM 2013 CỦA CHÍNH PHỦ QUY ĐỊNH XỬ PHẠT VI PHẠM HÀNH CHÍNH TRONG LĨNH VỰC BỔ TRỢ TƯ PHÁP,"",Nghị định 67/2015/NĐ-CP";;;;
ds_75,https://vbpl.vn/TW/Pages/vbpq-toanvan.aspx?ItemID=72266,QUY ĐỊNH CHI TIẾT VÀ HƯỚNG DẪN THI HÀNH MỘT SỐ ĐIỀU CỦA LUẬT THI HÀNH ÁN DÂN SỰ,Nghị định 62/2015/NĐ-CP;;;;
"ds_76,https://vbpl.vn/TW/Pages/vbpq-toanvan.aspx?ItemID=32874,""SỬA ĐỔI, BỔ SUNG MỘT SỐ ĐIỀU CỦA NGHỊ ĐỊNH SỐ 103/2008/NĐ-CP NGÀY 16 THÁNG 9 NĂM 2008 CỦA CHÍNH PHỦ VỀ BẢO HIỂM BẮT BUỘC"",Nghị định 214/2013/NĐ-CP";;;;
"ds_77,https://vbpl.vn/TW/Pages/vbpq-toanvan.aspx?ItemID=32498,""SỬA ĐỔI, BỔ SUNG MỘT SỐ ĐIỀU CỦA NGHỊ ĐỊNH SỐ 58/2009/NĐ-CP NGÀY 13 THÁNG 7 NĂM 2009 CỦA CHÍNH PHỦ QUY ĐỊNH CHI TIẾT VÀ HƯỚNG DẪN THI HÀNH MỘT SỐ ĐIỀU CỦA LUẬT THI HÀNH ÁN DÂN SỰ VỀ THỦ TỤC THI HÀNH ÁN DÂN SỰ"",Nghị định 125/2013/NĐ-CP";;;;
"ds_78,https://vbpl.vn/TW/Pages/vbpq-toanvan.aspx?ItemID=32442,""QUY ĐỊNH XỬ PHẠT VI PHẠM HÀNH CHÍNH TRONG LĨNH VỰC BỔ TRỢ TƯ PHÁP, HÀNH CHÍNH TƯ PHÁP, HÔN NHÂN VÀ GIA ĐÌNH, THI HÀNH ÁN DÂN SỰ,"",Nghị định 110/2013/NĐ-CP";;;;
"ds_79,https://vbpl.vn/TW/Pages/vbpq-toanvan.aspx?ItemID=26735,""SỬA ĐỔI, BỔ SUNG MỘT SỐ ĐIỀU CỦA NGHỊ ĐỊNH SỐ 100/2006/NĐ-CP NGÀY 21 THÁNG 9 NĂM 2006 QUY ĐỊNH CHI TIẾT VÀ HƯỚNG DẪN THI HÀNH MỘT SỐ ĐIỀU CỦA BỘ LUẬT DÂN SỰ, LUẬT SỞ HỮU TRÍ TUỆ"",Nghị định 85/2011/NĐ-CP";;;;
"ds_80,https://vbpl.vn/TW/Pages/vbpq-toanvan.aspx?ItemID=23667,""QUY ĐỊNH CHI TIẾT VÀ HƯỚNG DẪN THI HÀNH MỘT SỐ ĐIỀU CỦALUẬT THI HÀNH ÁN DÂN SỰ VỀ CƠ QUAN QUẢN LÝ THI HÀNH ÁN DÂN SỰ, CƠ QUANTHI HÀNH ÁN"",Nghị định 74/2009/NĐ-CP";;;;
ds_81,https://vbpl.vn/TW/Pages/vbpq-toanvan.aspx?ItemID=11805,QUY ĐỊNH CHI TIẾT VÀ HƯỚNG DẪN THI HÀNH MỘT SỐ ĐIỀU CỦA LUẬT THI HÀNH ÁN DÂN SỰ VỀ THỦ TỤC THI HÀNH ÁN DÂN SỰ,Nghị định 58/2009/NĐ-CP;;;;
ds_82,https://vbpl.vn/TW/Pages/vbpq-toanvan.aspx?ItemID=24620,VỀ PHÒNG THỦ DÂN SỰ,Nghị định 117/2008/NĐ-CP;;;;
ds_83,https://vbpl.vn/TW/Pages/vbpq-toanvan.aspx?ItemID=12675,VỀ BẢO HIỂM BẮT BUỘC TRÁCH NHIỆM DÂN SỰ CỦA CHỦ XE CƠ GIỚI,Nghị định 103/2008/NĐ-CP;;;;
ds_84,https://vbpl.vn/TW/Pages/vbpq-toanvan.aspx?ItemID=14957,QUY ĐỊNH CHI TIẾT THI HÀNH CÁC QUY ĐỊNH CỦA BỘ LUẬT DÂN SỰ VỀ QUAN HỆ DÂN SỰ CÓ YẾU TỐ NƯỚC NGOÀI,Nghị định 138/2006/NĐ-CP;;;;
"ds_85,https://vbpl.vn/TW/Pages/vbpq-toanvan.aspx?ItemID=15289,""QUY ĐỊNH CHI TIẾT VÀ HƯỚNG DẪN THI HÀNH MỘT SỐ ĐIỀU CỦA BỘ LUẬT DÂN SỰ, LUẬT SỞ HỮU TRÍ TUỆ VỀ QUYỀN TÁC GIẢ VÀ QUYỀN LIÊN QUAN"",Nghị định 100/2006/NĐ-CP";;;;
"ds_86,https://vbpl.vn/TW/Pages/vbpq-toanvan.aspx?ItemID=17346,""QUY ĐỊNH CHẾ ĐỘ BẢO HIỂM BẮT BUỘC TRÁCH NHIỆM DÂN SỰ CỦA NGƯỜI KINH DOANH VẬN TẢI HÀNH KHÁCH, HÀNG HÓA DỄ CHÁY VÀ DỄ NỔ TRÊN ĐƯỜNG THỦY NỘI ĐỊA"",Nghị định 125/2005/NĐ-CP";;;;
"ds_87,https://vbpl.vn/TW/Pages/vbpq-toanvan.aspx?ItemID=18435,""VỀ CƠ QUAN QUẢN LÝ THI HÀNH ÁN DÂN SỰ, CƠ QUAN THI HÀNH ÁN DÂN SỰ VÀ CÁN BỘ, CÔNG CHỨC LÀM CÔNG TÁC THI HÀNH ÁN DÂN SỰ"",Nghị định 50/2005/NĐ-CP";;;;
"ds_88,https://vbpl.vn/TW/Pages/vbpq-toanvan.aspx?ItemID=19147,""QUY ĐỊNH VỀ THỦ TỤC, CƯỠNG CHẾ VÀ XỬ PHẠT VI PHẠM HÀNH CHÍNH TRONG THI HÀNH ÁN DÂN SỰ"",Nghị định 173/2004/NĐ-CP";;;;
"ds_89,https://vbpl.vn/TW/Pages/vbpq-toanvan.aspx?ItemID=7086,""VỀ PHƯƠNG THỨC TRẢ NHÀ Ở, GIÁ CHO THUÊ NHÀ Ở KHI CHƯATRẢ LẠI NHÀ VÀ THỦ TỤC XÁC LẬP QUYỀN SỞ HỮU NHÀ Ở ĐƯỢC QUY ĐỊNH TẠI NGHỊ QUYẾTSỐ 58/1998/NQ-UBTVQH10 NGÀY 20/08/1998 CỦA ỦY BAN THƯỜNG VỤ QUỐC HỘI VỀGIAO DỊCH DÂN SỰ VỀ NHÀ Ở ĐƯỢC XÁC LẬP TRƯỚC NGÀY 01/07/1991"",Nghị định 25/1999/NĐ-CP";;;;
ds_90,https://vbpl.vn/TW/Pages/vbpq-toanvan.aspx?ItemID=8112,VỀ CHẾ ĐỘ BẢO HIỂM BẮT BUỘC TRÁCH NHIỆM DÂN SỰ CỦA CHỦ XE CƠ GIỚI,Nghị định 115/1997/NĐ-CP;;;;
ds_91,https://vbpl.vn/TW/Pages/vbpq-toanvan.aspx?ItemID=8489,HƯỚNG DẪN THI HÀNH CÁC QUY ĐỊNH CỦA BỘ LUẬT DÂN SỰ VỀ QUAN HỆ DÂN SỰ CÓ YẾU TỐ NƯỚC NGOÀI,Nghị định 60/CP;;;;
ds_92,https://vbpl.vn/TW/Pages/vbpq-toanvan.aspx?ItemID=8893,HƯỚNG DẪN THI HÀNH MỘT SỐ QUY ĐỊNH VỀ QUYỀN TÁC GIẢ TRONG BỘ LUẬT DÂN SỰ,Nghị định 76-CP;;;;
ds_93,https://vbpl.vn/TW/Pages/vbpq-toanvan.aspx?ItemID=10648,QUY ĐỊNH THỦ TỤC THI HÀNH ÁN DÂN SỰ,Nghị định 69-CP;;;;
"ds_94,https://vbpl.vn/TW/Pages/vbpq-toanvan.aspx?ItemID=10697,""VỀ TỔ CHỨC, NHIỆM VỤ, QUYỀN HẠNCỦA CÁC CƠ QUANQUẢN LÝ CÔNG TÁC THI HÀNH ÁN DÂN SỰ,"",Nghị định 30-CP";;;;
ds_95,https://vbpl.vn/TW/Pages/vbpq-toanvan.aspx?ItemID=2518,CỦA HỘI ĐỒNG BỘ TRƯỞNG SỐ 30/HĐBT NGÀY 10-3-1988 VỀ CHẾ ĐỘ BẢO HIỂM TRÁCH NHIỆM DÂN SỰ,Nghị định 30/HĐBT;;;;
"ds_96,https://vbpl.vn/TW/Pages/vbpq-toanvan.aspx?ItemID=162257,""SỬA ĐỔI, BỔ SUNG MỘT SỐ ĐIỀU CỦA QUYẾT ĐỊNH SỐ 61/2014/QĐ-TTG NGÀY 30 THÁNG 10 NĂM 2014 CỦA THỦ TƯỚNG CHÍNH PHỦ QUY ĐỊNH CHỨC NĂNG, NHIỆM VỤ, QUYỀN HẠN VÀ CƠ CẤU TỔ CHỨC CỦA TỔNG CỤC THI HÀNH ÁN DÂN SỰ TRỰC THUỘC BỘ TƯ PHÁP"",Quyết định 19/2023/QĐ-TTg";;;;
ds_97,https://vbpl.vn/TW/Pages/vbpq-toanvan.aspx?ItemID=46784,BAN HÀNH KẾ HOẠCH CỦA CHÍNH PHỦ VỀ VIỆC TỔ CHỨC LẤY Ý KIẾN NHÂN DÂN ĐỐI VỚI DỰ THẢO BỘ LUẬT DÂN SỰ (SỬA ĐỔI),Quyết định 01/QĐ-TTg;;;;
"ds_98,https://vbpl.vn/TW/Pages/vbpq-toanvan.aspx?ItemID=37429,""QUY ĐỊNH CHỨC NĂNG, NHIỆM VỤ, QUYỀN HẠN VÀ CƠ CẤU TỔ CHỨC CỦA TỔNG CỤC THI HÀNH ÁN DÂN SỰ TRỰC THUỘC BỘ TƯ PHÁP"",Quyết định 61/2014/QĐ-TTg";;;;
"ds_99,https://vbpl.vn/TW/Pages/vbpq-toanvan.aspx?ItemID=27803,""VỀ CHẾ ĐỘ BỒI DƯỠNG ĐỐI VỚI NGƯỜI THAM GIA PHIÊN TÒA, PHIÊN HỌP GIẢI QUYẾT VIỆC DÂN SỰ"",Quyết định 41/2012/QĐ-TTG";;;;
"ds_100,https://vbpl.vn/TW/Pages/vbpq-toanvan.aspx?ItemID=25092,""BAN HÀNH DANH SÁCH CÁC CƠ QUAN THI HÀNH ÁN DÂN SỰ TẠI CÁC ĐẠI BÀN MIỀN NÚI, VÙNG SÂU, VÙNG XA, HẢI ĐẢO ĐƯỢC TUYỂN CHỌN NGƯỜI CÓ TRÌNH ĐỘ CỬ NHÂN LUẬT LÀM CHẤP HÀNH VIÊN KHÔNG QUA THI TUYỂN"",Quyết định 1777/QĐ-TTg";;;;
"gt_1,https://vbpl.vn/TW/Pages/vbpq-toanvan.aspx?ItemID=170620,""TRẬT TỰ, AN TOÀN GIAO THÔNG ĐƯỜNG BỘ"",Luật 36/2024/QH15";;;;
gt_2,https://vbpl.vn/TW/Pages/vbpq-toanvan.aspx?ItemID=23115,VỀ VIỆC CÔNG BỐ LUẬT,Lệnh 07/2001/L-CTN;;;;
"gt_3,https://vbpl.vn/TW/Pages/vbpq-toanvan.aspx?ItemID=15083,""BAN HÀNH QUY ĐỊNH VỀ VIỆC SỬ DỤNG PHƯƠNG TIỆN, THIẾT BỊ KỸ THUẬT NGHIỆP VỤ CỦA LỰC LƯỢNG CẢNH SÁT NHÂN DÂN TRONG HOẠT ĐỘNG TUẦN TRA, KIỂM SOÁT VỀ TRẬT TỰ, AN TOÀN GIAO THÔNG"",Quyết định 238/2006/QĐ-TTg";;;;
gt_4,https://vbpl.vn/TW/Pages/vbpq-toanvan.aspx?ItemID=6607,CÔNG BỐ PHÁP LỆNH BẢO HỘ QUYỀN TÁC GIẢ; PHÁP LỆNH BẢO VỆ CÔNG TRÌNH GIAO THÔNG; PHÁP LỆNH KHAI THÁC VÀ BẢO VỆ CÔNG TRÌNH KHÍ TƯỢNG THUỶ VĂN,Lệnh 38-L/CTN;;
gt_5,https://vbpl.vn/TW/Pages/vbpq-toanvan.aspx?ItemID=66088,VỀ TĂNG CƯỜNG THỰC HIỆN CÁC GIẢI PHÁP TRỌNG TÂM BẢO ĐẢM TRẬT TỰ AN TOÀN GIAO THÔNG,Nghị quyết 88/NQ-CP;;;;
gt_6,https://vbpl.vn/TW/Pages/vbpq-toanvan.aspx?ItemID=25493,VỀ TỪNG BƯỚC KHẮC PHỤC ÙN TẮC GIAO THÔNG TẠI THÀNH PHỐ HÀ NỘI VÀ THÀNH PHỐ HỒ CHÍ MINH,Nghị quyết 16/2008/NQ-CP;;;;
gt_7,https://vbpl.vn/TW/Pages/vbpq-toanvan.aspx?ItemID=13940,VỀ MỘT SỐ GIẢI PHÁP CẤP BÁCH NHẰM KIỀM CHẾ TAI NẠN GIAO THÔNG VÀ ÙN TẮC GIAO THÔNG,Nghị quyết 32/2007/NQ-CP;;;;
gt_8,https://vbpl.vn/TW/Pages/vbpq-toanvan.aspx?ItemID=19385,NGHỊQUYẾT VỀ VIỆC PHÁT HÀNH TRÁI PHIẾU,Nghị quyết 414/2003/NQ-UBTVQH11;;;;
gt_9,https://vbpl.vn/TW/Pages/vbpq-toanvan.aspx?ItemID=21868,VỀ CÁC GIẢI PHÁP KIỀM CHẾ GIA TĂNG VÀ TIẾN TỚI GIẢM DẦNTAI NẠN GIAO THÔNG VÀ ÙN TẮC GIAO THÔNG,Nghị quyết 13/2002/NQ-CP;;;;
"gt_10,https://vbpl.vn/TW/Pages/vbpq-toanvan.aspx?ItemID=36824,""SỬA ĐỔI, BỔ SUNG MỘT SỐ ĐIỀU CỦA LUẬT GIAO THÔNG ĐƯỜNG THỦY NỘI ĐỊA"",Luật 48/2014/QH13";;;;
