DocumentID,Source,Content,Number;;;;
ld_18,https://vbpl.vn/TW/Pages/vbpq-toanvan.aspx?ItemID=101374,VỀ VIỆC PHÊ DUYỆT THỎA THUẬN GIỮA CHÍNH PHỦ NƯỚC CỘNG HÒA XÃ HỘI CHỦ NGHĨA VIỆT NAM VÀ CHÍNH PHỦ Ô-XTƠ-RÂY-LI-A VỀ CHƯƠNG TRÌNH LAO ĐỘNG KẾT HỢP KỲ NGHỈ,Nghị quyết 24/NQ-CP;;;;
ld_19,https://vbpl.vn/TW/Pages/vbpq-toanvan.aspx?ItemID=10427,LAO ĐỘNG CỦA NƯỚC CỘNG HÒA XÃ HỘI CHỦ NGHĨA VIỆT NAM,Bộ luật Không số;;;;
ld_20,https://vbpl.vn/TW/Pages/vbpq-toanvan.aspx?ItemID=70824,VỀ VIỆC THỰC HIỆN CHÍNH SÁCH HƯỞNG BẢO HIỂM XÃ HỘI MỘT LẦN ĐỐI VỚI NGƯỜI LAO ĐỘNG,Nghị quyết 93/2015/QH13;;;;
ld_21,https://vbpl.vn/TW/Pages/vbpq-toanvan.aspx?ItemID=41559,VỀ VIỆC ĐƠN GIẢN HÓA THỦ TỤC HÀNH CHÍNH THUỘC PHẠM VI CHỨC NĂNG QUẢN LÝ CỦA BỘ LAO ĐỘNG – THƯƠNG BINH VÀ XÃ HỘI,Nghị quyết 48/NQ-CP;;;;
"ld_22,https://vbpl.vn/TW/Pages/vbpq-toanvan.aspx?ItemID=11864,""SỬA ĐỔI, BỔ SUNG CHẾ ĐỘ ƯU TIÊN ĐỐI VỚI CÁN BỘ, CÔNG CHỨC VÀ NGƯỜI LAO ĐỘNG CỦA KIỂM TOÁN NHÀ NƯỚC BAN HÀNH KÈM THEO NGHỊ QUYẾT SỐ 1003/2006/NQ-UBTVQH11 NGÀY 03 THÁNG 3 NĂM 2006"",Nghị quyết 794/2009/NQ-UBTVQH12";;;;
ld_23,https://vbpl.vn/TW/Pages/vbpq-toanvan.aspx?ItemID=12195,NGHỊ QUYẾT,Nghị quyết 18/NQ-CP;;;;
"ld_24,https://vbpl.vn/TW/Pages/vbpq-toanvan.aspx?ItemID=14415,""VỀ VIỆC BỔ SUNG DỰ ÁN LUẬT SỬA ĐỔI, BỔ SUNG ĐIỀU 73 CỦA BỘ LUẬT LAO ĐỘNG VÀO CHƯƠNG TRÌNH XÂY DỰNG LUẬT, PHÁP LỆNH NĂM 2007"",Nghị quyết 76/2007/QH11";;;;
ld_25,https://vbpl.vn/TW/Pages/vbpq-toanvan.aspx?ItemID=14750,VỀ VIỆC CHẤM DỨT HIỆU LỰC CỦA NGHỊ ĐỊNH SỐ 81/2000/NĐ-CP NGÀY 29/12/ 2000 CỦA CHÍNH PHỦ QUY ĐỊNH CHI TIẾT VÀ HƯỚNG DẪN THI HÀNH,Nghị quyết 02/2007/NQ-CP;;;;
ld_26,https://vbpl.vn/TW/Pages/vbpq-toanvan.aspx?ItemID=16212,VỀ VIỆC CHẤM DỨT HIỆU LỰC CỦA PHÁP LỆNH NGHĨA VỤ LAO ĐỘNG CÔNG ÍCH,Nghị quyết 1014/2006/NQ-UBTVQH11;;;;
ld_27,https://vbpl.vn/TW/Pages/vbpq-toanvan.aspx?ItemID=3271,CỦA HỘI ĐỒNG NHÀ NƯỚC SỐ 655-NQ/HĐNN7 NGÀY 12 THÁNG 9 NĂM 1985,Nghị quyết 655-NQ/HĐNN7;;;;
ld_28,https://vbpl.vn/TW/Pages/vbpq-toanvan.aspx?ItemID=146643,NGƯỜI LAO ĐỘNG VIỆT NAM ĐI LÀM VIỆC Ở NƯỚC NGOÀI THEO HỢP ĐỒNG,Luật 69/2020/QH14;;;;
ld_29,https://vbpl.vn/TW/Pages/vbpq-toanvan.aspx?ItemID=3278,CỦA HỘI ĐỒNG NHÀ NƯỚC SỐ 616-NQ/HĐNN7 NGÀY 26 THÁNG 3 NĂM 1985,Nghị quyết 616-NQ/HĐNN7;;;;
ld_30,https://vbpl.vn/TW/Pages/vbpq-toanvan.aspx?ItemID=3279,CỦA HỘI ĐỒNG NHÀ NƯỚC SỐ 615-NQ/HĐNN7 NGÀY 26 THÁNG 3 NĂM 1985,Nghị quyết 615-NQ/HĐNN7;;;;
ld_31,https://vbpl.vn/TW/Pages/vbpq-toanvan.aspx?ItemID=3496,VỀ VIỆC HOÀN CHỈNH CÔNG TÁC KHOÁN SẢN PHẨM CUỐI CÙNG ĐẾN NHÓM LAO ĐỘNG VÀ NGƯỜI LAO ĐỘNG TRONG HỢP TÁC XÃ VÀ TẬP ĐOÀN SẢN XUẤT NÔNG NGHIỆP,Nghị quyết 154-HĐBT;;;;
ld_32,https://vbpl.vn/TW/Pages/vbpq-toanvan.aspx?ItemID=3641,QUYẾT NGHỊ CỦA HỘI ĐỒNG NHÀ NƯỚC SỐ 303/NQ-HĐNN7,Nghị quyết 303/NQ-HĐNN7;;;;
ld_33,https://vbpl.vn/TW/Pages/vbpq-toanvan.aspx?ItemID=1400,CỦA HỘI ĐỒNG CHÍNH PHỦ SỐ 362/CP NGÀY 29 THÁNG 11 NĂM 1980 VỀ VIỆC HỢP TÁC SỬ DỤNG LAO ĐỘNG VỚI,Nghị quyết 362/CP;;;;
"ld_34,https://vbpl.vn/TW/Pages/vbpq-toanvan.aspx?ItemID=1390,""SỐ 82-CP NGÀY 12 THÁNG 3 NĂM 1980 VỀ ĐIỀU ĐỘNG VÀ TUYỂN DỤNG LAO ĐỘNG VÀO LÀM VIỆC TẠI NÔNG TRƯỜNG, LÂM TRƯỜNG QUỐC DOANH Ở CÁC VÙNG KINH TẾ MỚI"",Nghị quyết 82-CP";;;;
"ld_35,https://vbpl.vn/TW/Pages/vbpq-toanvan.aspx?ItemID=17748,""VỀ VIỆC PHỐI HỢP HOẠT ĐỘNG NÂNG CAO TRÌNH ĐỘ HỌC VẤN, KỸ NĂNG NGHỀ NGHIỆP TRONG CÔNG NHÂN, VIÊN CHỨC, LAO ĐỘNG GIAI ĐOẠN 2005 - 2010"",Nghị quyết liên tịch 02/2005/NQLT/TLĐLĐVN-BGD";;;;
"ld_36,https://vbpl.vn/TW/Pages/vbpq-toanvan.aspx?ItemID=186453,""2. SỬA ĐỔI, BỔ SUNG KHOẢN 1 VÀ KHOẢN 3 ĐIỀU 4 NHƯ SAU:"",Nghị định 372/2025/NĐ-CP";;;;
ld_37,https://vbpl.vn/TW/Pages/vbpq-toanvan.aspx?ItemID=185561,PHẠM VI ĐIỀU CHỈNH,Nghị định 337/2025/NĐ-CP;;;;
ld_38,https://vbpl.vn/TW/Pages/vbpq-toanvan.aspx?ItemID=185164,PHẠM VI ĐIỀU CHỈNH,Nghị định 325/2025/NĐ-CP;;;;
ld_39,https://vbpl.vn/TW/Pages/vbpq-toanvan.aspx?ItemID=184625,PHẠM VI ĐIỀU CHỈNH,Nghị định 318/2025/NĐ-CP;;;;
ld_40,https://vbpl.vn/TW/Pages/vbpq-toanvan.aspx?ItemID=183939,QUY ĐỊNH MỨC LƯƠNG TỐI THIỂU ĐỐI VỚI NGƯỜI LAO ĐỘNG LÀM VIỆC THEO HỢP ĐỒNG LAO ĐỘNG,Nghị định 293/2025/NĐ-CP;;;;
ld_41,https://vbpl.vn/TW/Pages/vbpq-toanvan.aspx?ItemID=180273,QUY ĐỊNH VỀ NGƯỜI LAO ĐỘNG NƯỚC NGOÀI LÀM VIỆC TẠI VIỆT NAM,Nghị định 219/2025/NĐ-CP;;;;
"ld_42,https://vbpl.vn/TW/Pages/vbpq-toanvan.aspx?ItemID=177727,""QUY ĐỊNH MỘT SỐ CHÍNH SÁCH ĐỐI VỚI CƠ SỞCÔNG NGHIỆP QUỐC PHÒNG NÒNG CỐT, CƠ SỞ CÔNG NGHIỆP AN NINHNÒNG CỐT VÀ CHẾ ĐỘ, CHÍNH SÁCH ĐỐI VỚI NGƯỜI LAO ĐỘNG TRONG CƠ SỞCÔNG NGHIỆP QUỐC PHÒNG NÒNG CỐT, CƠ SỞ CÔNG NGHIỆP AN NINH NÒNG CỐT"",Nghị định 103/2025/NĐ-CP";;;;
"ld_43,https://vbpl.vn/TW/Pages/vbpq-toanvan.aspx?ItemID=176201,""VỀ SỬA ĐỔI, BỔ SUNG MỘT SỐ ĐIỀU CỦA NGHỊ ĐỊNH SỐ 178/2024/NĐ-CP NGÀY 31 THÁNG 12 NĂM 2024 CỦA CHÍNH PHỦ VỀ CHÍNH SÁCH, CHẾ ĐỘ ĐỐI VỚI CÁN BỘ, CÔNG CHỨC, VIÊN CHỨC, NGƯỜI LAO ĐỘNG VÀ LỰC LƯỢNG VŨ TRANG TRONG THỰC HIỆN SẮP XẾP TỔ CHỨC BỘ MÁY CỦA HỆ THỐNG CHÍNH TRỊ"",Nghị định 67/2025/NĐ-CP";;;;
"ld_44,https://vbpl.vn/TW/Pages/vbpq-toanvan.aspx?ItemID=175789,""QUẢN LÝ LAO ĐỘNG, TIỀN LƯƠNG, THÙ LAO, TIỀN THƯỞNG TRONG DOANH NGHIỆP NHÀ NƯỚC"",Nghị định 44/2025/NĐ-CP";;;;
"ld_45,https://vbpl.vn/TW/Pages/vbpq-toanvan.aspx?ItemID=173866,""VỀ CHÍNH SÁCH, CHẾ ĐỘ ĐỐI VỚI CÁN BỘ, CÔNG CHỨC, VIÊN CHỨC, NGƯỜI LAO ĐỘNG VÀ LỰC LƯỢNG VŨ TRANG TRONG THỰC HIỆN SẮP XẾP TỔ CHỨC BỘ MÁY CỦA HỆ THỐNG CHÍNH TRỊ"",Nghị định 178/2024/NĐ-CP";;;;
ld_46,https://vbpl.vn/TW/Pages/vbpq-toanvan.aspx?ItemID=173651,QUY ĐỊNH VỀ BẢO HIỂM TAI NẠN LAO ĐỘNG THEO HÌNH THỨC TỰ NGUYỆN ĐỐI VỚI NGƯỜI LAO ĐỘNG LÀM VIỆC KHÔNG THEO HỢP ĐỒNG LAO ĐỘNG,Nghị định 143/2024/NĐ-CP;;;;
"ld_47,https://vbpl.vn/TW/Pages/vbpq-toanvan.aspx?ItemID=173647,""SỬA ĐỔI, BỔ SUNG MỘT SỐ ĐIỀU CỦA NGHỊ ĐỊNH SỐ 121/2016/NĐ-CP"""">121/2016/NĐ-CP NGÀY 24 THÁNG 8 NĂM 2016 ĐÃ ĐƯỢC SỬA ĐỔI, BỔ SUNG TẠI NGHỊ ĐỊNH SỐ 74/2020/NĐ-CP"""">74/2020/NĐ-CP NGÀY 01 THÁNG 7 NĂM 2020 VÀ NGHỊ ĐỊNH SỐ 82/2021/NĐ-CP"""">82/2021/NĐ-CP NGÀY 06 THÁNG 9 NĂM 2021 CỦA CHÍNH PHỦ VỀ THỰC HIỆN THÍ ĐIỂM QUẢN LÝ LAO ĐỘNG, TIỀN LƯƠNG ĐỐI VỚI TẬP ĐOÀN CÔNG NGHIỆP - VIỄN THÔNG QUÂN ĐỘI"",Nghị định 79/2024/NĐ-CP";;;;
ld_48,https://vbpl.vn/TW/Pages/vbpq-toanvan.aspx?ItemID=168670,QUY ĐỊNH MỨC LƯƠNG TỐI THIỂU ĐỐI VỚI NGƯỜI LAO ĐỘNG LÀM VIỆC THEO HỢP ĐỒNG LAO ĐỘNG.,Nghị định 74/2024/NĐ-CP;;;;
"ld_49,https://vbpl.vn/TW/Pages/vbpq-toanvan.aspx?ItemID=70811,""AN TOÀN, VỆ SINH LAO ĐỘNG"",Luật 84/2015/QH13";;;;
"ld_50,https://vbpl.vn/TW/Pages/vbpq-toanvan.aspx?ItemID=173642,""SỬA ĐỔI, BỔ SUNG MỘT SỐ ĐIỀU CỦA NGHỊ ĐỊNH SỐ 51/2016/NĐ-CP NGÀY 13 THÁNG 6 NĂM 2016 CỦA CHÍNH PHỦ QUY ĐỊNH QUẢN LÝ LAO ĐỘNG, TIỀN LƯƠNG VÀ TIỀN THƯỞNG ĐỐI VỚI NGƯỜI LAO ĐỘNG LÀM VIỆC TRONG CÔNG TY TRÁCH NHIỆM HỮU HẠN MỘT THÀNH VIÊN DO NHÀ NƯỚC NẮM GIỮ 100% VỐN ĐIỀU LỆ VÀ NGHỊ ĐỊNH SỐ 52/2016/NĐ-CP NGÀY 13 THÁNG 6 NĂM 2016 CỦA CHÍNH PHỦ QUY ĐỊNH TIỀN LƯƠNG, THÙ LAO, TIỀN THƯỞNG ĐỐI VỚI NGƯỜI QUẢN LÝ CÔNG TY TRÁCH NHIỆM HỮU HẠN MỘT THÀNH VIÊN DO NHÀ NƯỚC NẮM GIỮ 100% VỐN ĐIỀU LỆ"",Nghị định 21/2024/NĐ-CP";;;;
"ld_51,https://vbpl.vn/TW/Pages/vbpq-toanvan.aspx?ItemID=162330,""SỬA ĐỔI, BỔ SUNG MỘT SỐ ĐIỀU CỦA NGHỊ ĐỊNH SỐ 152/2020/NĐ-CP NGÀY 30 THÁNG 12 NĂM 2020 CỦA CHÍNH PHỦ QUY ĐỊNH VỀ NGƯỜI LAO ĐỘNG NƯỚC NGOÀI LÀM VIỆC TẠI VIỆT NAM VÀ TUYỂN DỤNG, QUẢN LÝ NGƯỜI LAO ĐỘNG VIỆT NAM LÀM VIỆC CHO TỔ CHỨC, CÁ NHÂN NƯỚC NGOÀI TẠI VIỆT NAM"",Nghị định 70/2023/NĐ-CP";;;;
"ld_52,https://vbpl.vn/TW/Pages/vbpq-toanvan.aspx?ItemID=169624,""BỔ SUNG NGHỊ ĐỊNH SỐ 87/2021/NĐ-CP"""">87/2021/NĐ-CP NGÀY 29 THÁNG 9 NĂM 2021 CỦA CHÍNH PHỦ VỀ KÉO DÀI THỜI GIAN THỰC HIỆN VÀ SỬA ĐỔI, BỔ SUNG MỘT SỐ ĐIỀU CỦA NGHỊ ĐỊNH SỐ 20/2020/NĐ-CP"""">20/2020/NĐ-CP NGÀY 17 THÁNG 02 NĂM 2020 CỦA CHÍNH PHỦ THỰC HIỆN THÍ ĐIỂM QUẢN LÝ LAO ĐỘNG, TIỀN LƯƠNG, TIỀN THƯỞNG ĐỐI VỚI MỘT SỐ TẬP ĐOÀN KINH TẾ, TỔNG CÔNG TY NHÀ NƯỚC"",Nghị định 64/2023/NĐ-CP";;;;
"ld_53,https://vbpl.vn/TW/Pages/vbpq-toanvan.aspx?ItemID=162538,""QUY ĐỊNH CHI TIẾT THI HÀNH NGHỊ QUYẾT SỐ 54/2022/QH15 NGÀY 16 THÁNG 6 NĂM 2022 CỦA QUỐC HỘI THÍ ĐIỂM MÔ HÌNH TỔ CHỨC HOẠT ĐỘNG, LAO ĐỘNG, HƯỚNG NGHIỆP,DẠY NGHỀ CHO PHẠM NHÂN NGOÀI TRẠI GIAM"",Nghị định 09/2023/NĐ-CP";;;;
"ld_54,https://vbpl.vn/TW/Pages/vbpq-toanvan.aspx?ItemID=159806,""SỬA ĐỔI, BỔ SUNG MỘT SỐ ĐIỀU CỦA CÁC NGHỊ ĐỊNH LIÊN QUAN ĐẾN ĐIỀU KIỆN ĐẦU TƯ KINH DOANH VÀ THỦ TỤC HÀNH CHÍNH THUỘC PHẠM VI QUẢN LÝ NHÀ NƯỚC CỦA BỘ LAO ĐỘNG - THƯƠNG BINH VÀ XÃ HỘI"",Nghị định 04/2023/NĐ-CP";;;;
"ld_55,https://vbpl.vn/TW/Pages/vbpq-toanvan.aspx?ItemID=169619,""QUY ĐỊNH CHÍNH SÁCH ĐỐI VỚI NGƯỜI LAO ĐỘNG DÔI DƯ KHI CHUYỂN ĐỔI SỞ HỮU, SẮP XẾP LẠI CÔNG TY TRÁCH NHIỆM HỮU HẠN MỘT THÀNH VIÊN DO NHÀ NƯỚC NẮM GIỮ 100% VỐN ĐIỀU LỆ"",Nghị định 97/2022/NĐ-CP";;;;
"ld_56,https://vbpl.vn/TW/Pages/vbpq-toanvan.aspx?ItemID=169600,""QUY ĐỊNH CHỨC NĂNG, NHIỆM VỤ, QUYỀN HẠN VÀ CƠ CẤU TỔ CHỨC CỦA BỘ LAO ĐỘNG - THƯƠNG BINH VÀ XÃ HỘI"",Nghị định 62/2022/NĐ-CP";;;;
ld_57,https://vbpl.vn/TW/Pages/vbpq-toanvan.aspx?ItemID=154245,QUY ĐỊNH MỨC LƯƠNG TỐI THIỂU ĐỐI VỚI NGƯỜI LAO ĐỘNG LÀM VIỆC THEO HỢP ĐỒNG LAO ĐỘNG,Nghị định 38/2022/NĐ-CP;;;;
"ld_58,https://vbpl.vn/TW/Pages/vbpq-toanvan.aspx?ItemID=153913,""QUY ĐỊNH XỬ PHẠT VI PHẠM HÀNH CHÍNH TRONG LĨNH VỰC LAO ĐỘNG, BẢO HIỂM XÃ HỘI, NGƯỜI LAO ĐỘNG VIỆT NAM ĐI LÀM VIỆC Ở NƯỚC NGOÀI THEO HỢP ĐỒNG"",Nghị định 12/2022/NĐ-CP";;;;
"ld_59,https://vbpl.vn/TW/Pages/vbpq-toanvan.aspx?ItemID=152929,""1. ĐỐI VỚI MỖI NỘI DUNG HOẠT ĐỘNG QUY ĐỊNH TẠI ĐIỀU 9 CỦA LUẬT NGƯỜI LAO ĐỘNG VIỆT NAM ĐI LÀM VIỆC Ở NƯỚC NGOÀI THEO HỢP ĐỒNG, DOANH NGHIỆP PHẢI CÓ ÍT NHẤT 01 NHÂN VIÊN NGHIỆP VỤ CHỊU TRÁCH NHIỆM THỰC HIỆN, ĐÁP ỨNG MỘT TRONG NHỮNG TIÊU CHUẨN SAU:"",Nghị định 112/2021/NĐ-CP";;;;
"ld_60,https://vbpl.vn/TW/Pages/vbpq-toanvan.aspx?ItemID=14456,""NƯỚC CỘNG HÒA XÃ HỘI CHỦ NGHĨA VIỆT NAM KHOÁ XI, KỲ HỌP THỨ 11"",Luật 84/2007/QH11";;;;
"ld_61,https://vbpl.vn/TW/Pages/vbpq-toanvan.aspx?ItemID=155009,""VỀ KÉO DÀI THỜI GIAN THỰC HIỆN VÀ SỬA ĐỔI, BỔ SUNG MỘT SỐ ĐIỀU CỦA NGHỊ ĐỊNH SỐ 20/2020/NĐ-CP NGÀY 17 THÁNG 02 NĂM 2020 CỦA CHÍNH PHỦ THỰC HIỆN THÍ ĐIỂM QUẢN LÝ LAO ĐỘNG, TIỀN LƯƠNG, TIỀN THƯỞNG ĐỐI VỚI MỘT SỐ TẬP ĐOÀN KINH TẾ, TỔNG CÔNG TY NHÀ NƯỚC"",Nghị định 87/2021/NĐ-CP";;;;
"ld_62,https://vbpl.vn/TW/Pages/vbpq-toanvan.aspx?ItemID=169625,""VỀ KÉO DÀI THỜI GIAN THỰC HIỆN VÀ SỬA ĐỔI, BỔ SUNG MỘT SỐ ĐIỀU CỦA NGHỊ ĐỊNH SỐ 121/2016/NĐ-CP"""">121/2016/NĐ-CP NGÀY 24 THÁNG 8 NĂM 2016 ĐÃ ĐƯỢC SỬA ĐỔI, BỔ SUNG TẠI NGHỊ ĐỊNH SỐ 74/2020/NĐ-CP"""">74/2020/NĐ-CP NGÀY 01 THÁNG 7 NĂM 2020 CỦA CHÍNH PHỦ VỀ THỰC HIỆN THÍ ĐIỂM QUẢN LÝ LAO ĐỘNG, TIỀN LƯƠNG ĐỐI VỚI TẬP ĐOÀN CÔNG NGHIỆP - VIỄN THÔNG QUÂN ĐỘI"",Nghị định 82/2021/NĐ-CP";;;;
"ld_63,https://vbpl.vn/TW/Pages/vbpq-toanvan.aspx?ItemID=147168,""QUY ĐỊNH CHI TIẾT MỘT SỐ ĐIỀU CỦA NGHỊ QUYẾT SỐ 132/2020/QH14 NGÀY 17 THÁNG 11 NĂM 2020 CỦA QUỐC HỘI THÍ ĐIỂM MỘT SỐ CHÍNH SÁCH ĐỂ THÁO GỠ VƯỚNG MẮC, TỒN ĐỌNG TRONG QUẢN LÝ, SỬ DỤNG ĐẤT QUỐC PHÒNG, AN NINH KẾT HỢP VỚI HOẠT ĐỘNG LAO ĐỘNG SẢN XUẤT, XÂY DỰNG KINH TẾ"",Nghị định 26/2021/NĐ-CP";;;;
"ld_64,https://vbpl.vn/TW/Pages/vbpq-toanvan.aspx?ItemID=152669,""QUY ĐỊNH VỀ NGƯỜI LAO ĐỘNG NƯỚC NGOÀI LÀM VIỆC TẠI VIỆT NAM VÀ TUYỂN DỤNG, QUẢN LÝ NGƯỜI LAO ĐỘNG VIỆT NAM LÀM VIỆC CHO TỔ CHỨC, CÁ NHÂN NƯỚC NGOÀI TẠI VIỆT NAM"",Nghị định 152/2020/NĐ-CP";;;;
ld_65,https://vbpl.vn/TW/Pages/vbpq-toanvan.aspx?ItemID=152668,QUY ĐỊNH CHI TIẾT VÀ HƯỚNG DẪN THI HÀNH MỘT SỐ ĐIỀU CỦA BỘ LUẬT LAO ĐỘNG VỀ ĐIỀU KIỆN LAO ĐỘNG VÀ QUAN HỆ LAO ĐỘNG,Nghị định 145/2020/NĐ-CP;;;;
"ld_66,https://vbpl.vn/TW/Pages/vbpq-toanvan.aspx?ItemID=143470,""QUY ĐỊNH CHI TIẾT VÀ HƯỚNG DẪN THI HÀNH MỘT SỐ ĐIỀU CỦA LUẬT AN TOÀN, VỆ SINH LAO ĐỘNG VỀ BẢO HIỂM TAI NẠN LAO ĐỘNG, BỆNH NGHỀ NGHIỆP BẮT BUỘC"",Nghị định 88/2020/NĐ-CP";;;;
"ld_67,https://vbpl.vn/TW/Pages/vbpq-toanvan.aspx?ItemID=142832,""SỬA ĐỔI, BỔ SUNG MỘT SỐ ĐIỀU CỦA NGHỊ ĐỊNH SỐ 121/2016/NĐ-CP NGÀY 24 THÁNG 8 NĂM 2016 CỦA CHÍNH PHỦ THỰC HIỆN THÍ ĐIỂM QUẢN LÝ LAO ĐỘNG, TIỀN LƯƠNG ĐỐI VỚI TẬP ĐOÀN VIỄN THÔNG QUÂN ĐỘI GIAI ĐOẠN 2016 - 2020"",Nghị định 74/2020/NĐ-CP";;;;
"ld_68,https://vbpl.vn/TW/Pages/vbpq-toanvan.aspx?ItemID=142815,""QUY ĐỊNH MỨC ĐÓNG BẢO HIỂM XÃ HỘI BẮT BUỘC VÀO QUỸ BẢO HIỂM TAI NẠN LAO ĐỘNG, BỆNH NGHỀ NGHIỆP"",Nghị định 58/2020/NĐ-CP";;;;
"ld_69,https://vbpl.vn/TW/Pages/vbpq-toanvan.aspx?ItemID=141147,""QUY ĐỊNH XỬ PHẠT VI PHẠM HÀNH CHÍNH LĨNH VỰC LAO ĐỘNG, BẢO HIỂM XÃ HỘI, ĐƯA NGƯỜI LAO ĐỘNG VIỆT NAM ĐI LÀM VIỆC Ở NƯỚC NGOÀI THEO HỢP ĐỒNG"",Nghị định 28/2020/NĐ-CP";;;;
"ld_70,https://vbpl.vn/TW/Pages/vbpq-toanvan.aspx?ItemID=138335,""VỀ CHÍNH SÁCH ĐỐI VỚI CÁN BỘ, CÔNG CHỨC, VIÊN CHỨC, NGƯỜI LAO ĐỘNG VÀ NGƯỜI HƯỞNG LƯƠNG TRONG LỰC LƯỢNG VŨ TRANG CÔNG TÁC Ở VÙNG"",Nghị định 76/2019/NĐ-CP";;;;
"ld_71,https://vbpl.vn/TW/Pages/vbpq-toanvan.aspx?ItemID=14276,""KHÓA XI, KỲ HỌP THỨ 10"",Luật 72/2006/QH11";;;;
ld_72,https://vbpl.vn/TW/Pages/vbpq-toanvan.aspx?ItemID=132026,QUY ĐỊNH CHÍNH SÁCH ĐIỀU CHỈNH LƯƠNG HƯU ĐỐI VỚI LAO ĐỘNG NỮ BẮT ĐẦU HƯỞNG LƯƠNG HƯU TRONG GIAI ĐOẠN TỪ NĂM 2018 ĐẾN NĂM 2021 CÓ THỜI GIAN ĐÓNG BẢO HIỂM XÃ HỘI TỪ ĐỦ 20 NĂM ĐẾN 29 NĂM 6 THÁNG,Nghị định 153/2018/NĐ-CP;;;;
ld_73,https://vbpl.vn/TW/Pages/vbpq-toanvan.aspx?ItemID=132028,QUY ĐỊNH CHI TIẾT KHOẢN 3 ĐIỀU 63 CỦA BỘ LUẬT LAO ĐỘNG VỀ THỰC HIỆN QUY CHẾ DÂN CHỦ Ở CƠ SỞ TẠI NƠI LÀM VIỆC,Nghị định 149/2018/NĐ-CP;;;;
"ld_74,https://vbpl.vn/TW/Pages/vbpq-toanvan.aspx?ItemID=131643,""SỬA ĐỔI, BỔ SUNG MỘT SỐ ĐIỀU CỦA NGHỊ ĐỊNH SỐ 05/2015/NĐ-CP NGÀY 12 THÁNG 01 NĂM 2015 CỦA CHÍNH PHỦ QUY ĐỊNH CHI TIẾT VÀ HƯỚNG DẪN THI HÀNH MỘT SỐ NỘI DUNG CỦA BỘ LUẬT LAO ĐỘNG"",Nghị định 148/2018/NĐ-CP";;;;
"ld_75,https://vbpl.vn/TW/Pages/vbpq-toanvan.aspx?ItemID=131592,""QUY ĐỊNH CHI TIẾT LUẬT BẢO HIỂM XÃ HỘI VÀ LUẬT AN TOÀN, VỆ SINH LAO ĐỘNG VỀ BẢO HIỂM XÃ HỘI BẮT BUỘC ĐỐI VỚI NGƯỜI LAO ĐỘNG LÀ CÔNG DÂN NƯỚC NGOÀI LÀM VIỆC TẠI VIỆT NAM"",Nghị định 143/2018/NĐ-CP";;;;
"ld_76,https://vbpl.vn/TW/Pages/vbpq-toanvan.aspx?ItemID=131493,""SỬA ĐỔI, BỔ SUNG CÁC NGHỊ ĐỊNH LIÊN QUAN ĐẾN ĐIỀU KIỆN ĐẦU TƯ KINH DOANH VÀ THỦ TỤC HÀNH CHÍNH THUỘC PHẠM VI QUẢN LÝ NHÀ NƯỚC CỦA BỘ LAO ĐỘNG - THƯƠNG BINH VÀ XÃ HỘI"",Nghị định 140/2018/NĐ-CP";;;;
"ld_77,https://vbpl.vn/TW/Pages/vbpq-toanvan.aspx?ItemID=131010,""SỬA ĐỔI, BỔ SUNG MỘT SỐ ĐIỀU CỦA NGHỊ ĐỊNH SỐ 49/2013/NĐ-CP NGÀY 14 THÁNG 5 NĂM 2013 CỦA CHÍNH PHỦ QUY ĐỊNH CHI TIẾT THI HÀNH MỘT SỐ ĐIỀU CỦA BỘ LUẬT LAO ĐỘNG VỀ TIỀN LƯƠNG"",Nghị định 121/2018/NĐ-CP";;;;
ld_78,https://vbpl.vn/TW/Pages/vbpq-toanvan.aspx?ItemID=126319,QUY ĐỊNH MỨC LƯƠNG TỐI THIỂU VÙNG ĐỐI VỚI NGƯỜI LAO ĐỘNG LÀM VIỆC THEO HỢP ĐỒNG LAO ĐỘNG,Nghị định 141/2017/NĐ-CP;;;;
"ld_79,https://vbpl.vn/TW/Pages/vbpq-toanvan.aspx?ItemID=113065,""THỰC HIỆN THÍ ĐIỂM QUẢN LÝ LAO ĐỘNG, TIỀN LƯƠNG ĐỐI VỚI TẬP ĐOÀN VIỄN THÔNG QUÂN ĐỘI GIAI ĐOẠN 2016 - 2020"",Nghị định 121/2016/NĐ-CP";;;;
"ld_80,https://vbpl.vn/TW/Pages/vbpq-toanvan.aspx?ItemID=105812,""NGHỊ ĐỊNH NÀY ĐIỀU CHỈNH MỨC LƯƠNG HƯU, TRỢ CẤP MẤT SỨC LAO ĐỘNG HẰNG THÁNG"; TRỢ CẤP HẰNG THÁNG ĐỐI VỚI QUÂN NHÂN, CÔNG AN NHÂN DÂN, NGƯỜI LÀM CÔNG TÁC CƠ YẾU, CÁN BỘ XÃ ĐÃ NGHỈ VIỆC;" TRỢ CẤP ĐỐI VỚI GIÁO VIÊN MẦM NON CÓ THỜI GIAN LÀM VIỆC TRƯỚC NĂM 1995."",Nghị định 55/2016/NĐ-CP";;
"ld_81,https://vbpl.vn/TW/Pages/vbpq-toanvan.aspx?ItemID=105814,""QUY ĐỊNH VỀ LAO ĐỘNG, TIỀN LƯƠNG, THÙ LAO, TIỀN THƯỞNG ĐỐI VỚI CÔNG TY CÓ CỔ PHẦN, VỐN GÓP CHI PHỐI CỦA NHÀ NƯỚC"",Nghị định 53/2016/NĐ-CP";;;;
"ld_82,https://vbpl.vn/TW/Pages/vbpq-toanvan.aspx?ItemID=105816,""QUY ĐỊNH QUẢN LÝ LAO ĐỘNG, TIỀN LƯƠNG VÀ TIỀN THƯỞNG ĐỐI VỚI NGƯỜI LAO ĐỘNG LÀM VIỆC TRONG CÔNG TY TRÁCH NHIỆM HỮU HẠN MỘT THÀNH VIÊN DO NHÀ NƯỚC NẮM GIỮ 100% VỐN ĐIỀU LỆ"",Nghị định 51/2016/NĐ-CP";;;;
"ld_83,https://vbpl.vn/TW/Pages/vbpq-toanvan.aspx?ItemID=105823,""QUY ĐỊNH CHI TIẾT VÀ HƯỚNG DẪN THI HÀNH MỘT SỐ ĐIỀU CỦA LUẬT AN TOÀN, VỆ SINH LAO ĐỘNG VỀ BẢO HIỂM TAI NẠN LAO ĐỘNG, BỆNH NGHỀ NGHIỆP BẮT BUỘC"",Nghị định 37/2016/NĐ-CP";;;;
"ld_84,https://vbpl.vn/TW/Pages/vbpq-toanvan.aspx?ItemID=105821,""QUY ĐỊNH CHI TIẾT THI HÀNH MỘT SỐ ĐIỀU CỦA LUẬT AN TOÀN, VỆ SINH LAO ĐỘNG"",Nghị định 39/2016/NĐ-CP";;;;
"ld_85,https://vbpl.vn/TW/Pages/vbpq-toanvan.aspx?ItemID=117760,""QUY ĐỊNH CHI TIẾT MỘT SỐ ĐIỀU CỦA LUẬT AN TOÀN, VỆ SINH LAO ĐỘNG VỀ HOẠT ĐỘNG KIỂM ĐỊNH KỸ THUẬT AN TOÀN LAO ĐỘNG, HUẤN LUYỆN AN TOÀN, VỆ SINH LAO ĐỘNG VÀ QUAN TRẮC MÔI TRƯỜNG LAO ĐỘNG"",Nghị định 44/2016/NĐ-CP";;;;
ld_86,https://vbpl.vn/TW/Pages/vbpq-toanvan.aspx?ItemID=97142,QUY ĐỊNH CHI TIẾT THI HÀNH MỘT SỐ ĐIỀU CỦA BỘ LUẬT LAO ĐỘNG VỀ LAO ĐỘNG NƯỚC NGOÀI LÀM VIỆC TẠI VIỆT NAM,Nghị định 11/2016/NĐ-CP;;;;
"ld_87,https://vbpl.vn/TW/Pages/vbpq-toanvan.aspx?ItemID=92898,""QUY ĐỊNH MỨC LƯƠNG TỐI THIỂU VÙNG ĐỐI VỚI NGƯỜI LAO ĐỘNG LÀM VIỆC Ở DOANH NGHIỆP, LIÊN HIỆP HỢP TÁC XÃ, HỢP TÁC XÃ, TỔ HỢP TÁC, TRANG TRẠI, HỘ GIA ĐÌNH, CÁ NHÂN VÀ CÁC CƠ QUAN, TỔ CHỨC CÓ SỬ DỤNG LAO ĐỘNG THEO HỢP ĐỒNG LAO ĐỘNG"",Nghị định 122/2015/NĐ-CP";;;;
"ld_88,https://vbpl.vn/TW/Pages/vbpq-toanvan.aspx?ItemID=85953,""SỬA ĐỔI, BỔ SUNG MỘT SỐ ĐIỀU CỦA NGHỊ ĐỊNH SỐ 95/2013/NĐ-CP NGÀY 22 THÁNG 8 NĂM 2013 CỦA CHÍNH PHỦ QUY ĐỊNH XỬ PHẠT VI PHẠM HÀNH CHÍNH TRONG LĨNH VỰC LAO ĐỘNG, BẢO HIỂM XÃ HỘI,"",Nghị định 88/2015/NĐ-CP";;;;
ld_89,https://vbpl.vn/TW/Pages/vbpq-toanvan.aspx?ItemID=84922,QUY ĐỊNH CHI TIẾT MỘT SỐ ĐIỀU CỦA BỘ LUẬT LAO ĐỘNG VỀ CHÍNH SÁCH ĐỐI VỚI LAO ĐỘNG NỮ,Nghị định 85/2015/NĐ-CP;;;;
ld_90,https://vbpl.vn/TW/Pages/vbpq-toanvan.aspx?ItemID=72046,QUY ĐỊNH CHÍNH SÁCH ĐỐI VỚI NGƯỜI LAO ĐỘNG DÔI DƯ KHI SẮP XẾP LẠI CÔNG TY TRÁCH NHIỆM HỮU HẠN MỘT THÀNH VIÊN DO NHÀ NƯỚC LÀM CHỦ SỞ HỮU,Nghị định 63/2015/NĐ-CP;;;;
ld_91,https://vbpl.vn/TW/Pages/vbpq-toanvan.aspx?ItemID=48298,QUY ĐỊNH CHI TIẾT VÀ HƯỚNG DẪN THI HÀNH MỘT SỐ NỘI DUNG CỦA BỘ LUẬT LAO ĐỘNG,Nghị định 05/2015/NĐ-CP;;;;
"ld_92,https://vbpl.vn/TW/Pages/vbpq-toanvan.aspx?ItemID=45990,""QUY ĐỊNH CHI TIẾT MỘT SỐ ĐIỀU CỦA BỘ LUẬT LAO ĐỘNG, LUẬT DẠY NGHỀ, LUẬT NGƯỜI LAO ĐỘNG VIỆT NAM ĐI LÀM VIỆC Ở NƯỚC NGOÀI THEO"",Nghị định 119/2014/NĐ-CP";;;;
"ld_93,https://vbpl.vn/TW/Pages/vbpq-toanvan.aspx?ItemID=37648,""QUY ĐỊNH MỨC LƯƠNG TỐI THIỂU VÙNG ĐỐI VỚI NGƯỜI LAO ĐỘNG LÀM VIỆC Ở DOANH NGHIỆP, HỢP TÁC XÃ, TỔ HỢP TÁC, TRANG TRẠI, HỘ GIA ĐÌNH, CÁ NHÂN VÀ CÁC CƠ QUAN, TỔ CHỨC CÓ THUÊ MƯỚN LAO ĐỘNG THEO HỢP ĐỒNG LAO ĐỘNG"",Nghị định 103/2014/NĐ-CP";;;;
"ld_94,https://vbpl.vn/TW/Pages/vbpq-toanvan.aspx?ItemID=36920,""QUY ĐỊNH CHI TIẾT THI HÀNH MỘT SỐ ĐIỀU CỦA BỘ LUẬT LAO ĐỘNG VỀ TUYỂN DỤNG, QUẢN LÝ NGƯỜI LAO ĐỘNG VIỆT NAM LÀM VIỆC CHO"",Nghị định 75/2014/NĐ-CP";;;;
"ld_95,https://vbpl.vn/TW/Pages/vbpq-toanvan.aspx?ItemID=36843,""SỬA ĐỔI, BỔ SUNG ĐIỀU 29 NGHỊ ĐỊNH SỐ 55/2013/NĐ-CP NGÀY 22 THÁNG 5 NĂM 2013 CỦA CHÍNH PHỦ QUY ĐỊNH CHI TIẾT THI HÀNH KHOẢN 3 ĐIỀU 54 CỦA BỘ LUẬT LAO ĐỘNG VỀ VIỆC CẤP PHÉP HOẠT ĐỘNG CHO THUÊ LẠI LAO ĐỘNG,"",Nghị định 73/2014/NĐ-CP";;;;
"ld_96,https://vbpl.vn/TW/Pages/vbpq-toanvan.aspx?ItemID=36142,""QUY ĐỊNH VIỆC CƠ QUAN QUẢN LÝ NHÀ NƯỚC LẤY Ý KIẾN TỔ CHỨC ĐẠI DIỆN NGƯỜI LAO ĐỘNG, TỔ CHỨC ĐẠI DIỆN NGƯỜI SỬ DỤNG LAO ĐỘNG"",Nghị định 53/2014/NĐ-CP";;;;
ld_97,https://vbpl.vn/TW/Pages/vbpq-toanvan.aspx?ItemID=34095,QUY ĐỊNH CHI TIẾT THI HÀNH MỘT SỐ ĐIỀU CỦA BỘ LUẬT LAO ĐỘNG VỀ LAO ĐỘNG LÀ NGƯỜI GIÚP VIỆC GIA ĐÌNH,Nghị định 27/2014/NĐ-CP;;;;
ld_98,https://vbpl.vn/TW/Pages/vbpq-toanvan.aspx?ItemID=33381,QUY ĐỊNH CHI TIẾT THI HÀNH MỘT SỐ ĐIỀU CỦA BỘ LUẬT LAO ĐỘNG VỀ VIỆC LÀM,Nghị định 03/2014/NĐ-CP;;;;
"ld_99,https://vbpl.vn/TW/Pages/vbpq-toanvan.aspx?ItemID=32608,""QUY ĐỊNH MỨC LƯƠNG TỐI THIỂU VÙNG ĐỐI VỚI NGƯỜI LAO ĐỘNG LÀM VIỆC Ở DOANH NGHIỆP, HỢP TÁC XÃ, TỔ HỢP TÁC, TRANG TRẠI, HỘ GIA ĐÌNH, CÁ NHÂN VÀ CÁC CƠ QUAN,"",Nghị định 182/2013/NĐ-CP";;;;
ld_100,https://vbpl.vn/TW/Pages/vbpq-toanvan.aspx?ItemID=32399,QUY ĐỊNH CHI TIẾT THI HÀNH MỘT SỐ ĐIỀU CỦA BỘ LUẬT LAO ĐỘNG VỀ LAO ĐỘNG NƯỚC NGOÀI LÀM VIỆC TẠI VIỆT NAM,Nghị định 102/2013/NĐ-CP;;;;
